,Question,GT Answer,GT Topic,2008 Bleu Score,2008 Predicted,2008 Topic,2014 Bleu Score,2014 Predicted,2014 Topic,2016 Bleu Score,2016 Predicted,2016 Topic,2018 Bleu Score,2018 Predicted,2018 Topic,2020 Bleu Score,2020 Predicted,2020 Topic,2021 Bleu Score,2021 Predicted,2021 Topic,max - min
844,when does the next episode of izombie air,"['May 7 , 2018', 'May 14 , 2018']",List of iZombie episodes,-1.0,None,None,-1.0,None,None,0.0,"October 6, 2015",List of iZombie episodes,23.88437701912631,"February 26, 2018",List of iZombie episodes,-1.0,None,None,36.787944117144235,May 2018,List of iZombie episodes,37.787944117144235
845,where was the u.s.s maine when it exploded in 1898,"['Havana Harbor', 'Havana Harbor , Havana , Cuba']",USS Maine (ACR-1),100.0,Havana Harbor,USS Maine (ACR-1),100.0,Havana Harbor,USS Maine (ACR-1),100.0,Havana Harbor,USS Maine (ACR-1),100.0,Havana Harbor,USS Maine (ACR-1),-1.0,None,None,-1.0,None,None,101.0
846,which central american nations border the pacific ocean and the caribbean sea,"['Costa Rica', 'Nicaragua']",List of countries bordering on two or more oceans,-1.0,None,None,0.0,"countries which border two or more oceans, including sovereign states but excluding all dependencies",List of countries bordering on two or more oceans,-1.0,None,None,0.0,transcontinental countries,List of countries bordering on two or more oceans,0.0,Countries which border on multiple oceans because of discontiguous regions are excluded here but included in the list of transcontinental countries,List of countries bordering on two or more oceans,0.0,Countries which border on multiple oceans because of discontiguous regions are excluded here but included in the list of transcontinental countries,List of countries bordering on two or more oceans,1.0
847,which organelle is the site of atp production and storage,['mitochondrion'],Organelle,0.0,mitochondria,Organelle,0.0,mitochondria,Organelle,0.0,mitochondria,Organelle,0.0,mitochondria,Organelle,0.0,cytoplasm,Organelle,0.0,cytoplasm,Organelle,0.0
848,who does the democratic republic of congo trade with,"['China', 'AU']",Economy of the Democratic Republic of the Congo,0.0,the IMF and World Bank,Economy of the Democratic Republic of the Congo,0.0,Congolese,Economy of the Democratic Republic of the Congo,0.0,World Bank,Economy of the Democratic Republic of the Congo,0.0,International Monetary Fund,Economy of the Democratic Republic of the Congo,0.0,Belgium,Economy of the Democratic Republic of the Congo,0.0,World Bank,Economy of the Democratic Republic of the Congo,0.0
849,what type of snake is kaa in jungle book,['Indian rock python'],Kaa,30.326532985631673,huge python,Kaa,100.0,Indian rock python,Kaa,100.0,Indian rock python,Kaa,0.0,huge and powerful,Kaa,0.0,huge and powerful,Kaa,0.0,giant,Kaa,100.0
850,who sings the theme song for living single,['Queen Latifah'],Living Single,100.0,Queen Latifah,Living Single,100.0,Queen Latifah,Living Single,100.0,Queen Latifah,Living Single,100.0,Queen Latifah,Living Single,100.0,Queen Latifah,Living Single,100.0,Queen Latifah,Living Single,0.0
851,winner of worst cooks in america season 5,['Amber Brauner'],Worst Cooks in America,-1.0,None,None,0.0,Flay,Worst Cooks in America,0.0,chef Bobby Flay,Worst Cooks in America,0.0,12,Worst Cooks in America,0.0,12,Worst Cooks in America,0.0,12,Worst Cooks in America,1.0
852,who has won more grand slam titles in tennis,['Roger Federer'],List of Grand Slam men's singles champions,-1.0,None,None,-1.0,None,None,0.0,various players,List of Grand Slam men's singles champions,0.0,various players,List of Grand Slam men's singles champions,0.0,various players,List of Grand Slam men's singles champions,0.0,various players,List of Grand Slam men's singles champions,1.0
853,when was the last time the los angeles lakers won a championship,"['2010', 'in 2010']",Los Angeles Lakers,0.0,2000-02,Los Angeles Lakers,100.0,2010,Los Angeles Lakers,100.0,2010,Los Angeles Lakers,100.0,2010,Los Angeles Lakers,0.0,2000,Los Angeles Lakers,0.0,2000,Los Angeles Lakers,100.0
854,how many gold medals did australia win in the 2000 olympics,['16'],Australia at the 2000 Summer Olympics,0.0,5,Australia at the 2000 Summer Olympics,0.0,5,Australia at the 2000 Summer Olympics,0.0,5,Australia at the 2000 Summer Olympics,0.0,"5 Gold, 9 Silver, and 4 Bronze medals",Australia at the 2000 Summer Olympics,0.0,2,Australia at the 2000 Summer Olympics,0.0,5,Australia at the 2000 Summer Olympics,0.0
855,where is the eagle creek fire located in oregon,"[""45 ° 37 ′ 48 '' N 121 ° 54 ′ 14 '' W \ufeff / \ufeff 45.63 ° N 121.904 °"", 'Cascade Locks', 'Columbia River Gorge']",Eagle Creek Fire,-1.0,None,None,-1.0,None,None,-1.0,None,None,100.0,Columbia River Gorge,Eagle Creek Fire,100.0,Columbia River Gorge,Eagle Creek Fire,100.0,Cascade Locks,Eagle Creek Fire,101.0
856,who made the most free throws in nba history,['Karl Malone'],List of National Basketball Association career free throw scoring leaders,-1.0,None,None,0.0,National Basketball Association players,List of National Basketball Association career free throw scoring leaders,-1.0,None,None,0.0,National Basketball Association players,List of National Basketball Association career free throw scoring leaders,-1.0,None,None,0.0,National Basketball Association players,List of National Basketball Association career free throw scoring leaders,1.0
857,what disney cartoon character's middle name is fauntleroy,"['Donald Fauntleroy Duck', 'Donald Duck']",Donald Duck,100.0,Donald Duck,Donald Duck,100.0,Donald Duck,Donald Duck,100.0,Donald Duck,Donald Duck,100.0,Donald Duck,Donald Duck,100.0,Donald Duck,Donald Duck,50.0,Daisy Duck,Donald Duck,50.0
858,where does the saskatchewan river start and end,"['central Saskatchewan', 'from the Canadian Rockies continental divide east to central Saskatchewan', 'Saskatchewan Glacier , Alberta']",North Saskatchewan River,33.33333333333333,Saskatchewan River Forks,North Saskatchewan River,33.33333333333333,Saskatchewan River Forks,North Saskatchewan River,42.857142857142854,Prince Albert to the Saskatchewan River Forks,North Saskatchewan River,33.33333333333333,Saskatchewan River Forks,North Saskatchewan River,33.33333333333333,Saskatchewan River Forks,North Saskatchewan River,33.33333333333333,Saskatchewan River Forks,North Saskatchewan River,9.523809523809526
859,when was the last time miss texas won miss america,['1975'],List of Miss America titleholders,-1.0,None,None,0.0,Miss America title.,List of Miss America titleholders,0.0,1921,List of Miss America titleholders,0.0,There have been no Miss America winners,List of Miss America titleholders,-1.0,None,None,0.0,There have been no Miss America winners,List of Miss America titleholders,1.0
860,last team to win fa cup outside top flight,"['West Ham United ( 1980 )', 'West Ham United', 'Arsenal']",FA Cup,100.0,West Ham United,FA Cup,100.0,West Ham United,FA Cup,0.0,Cardiff City,FA Cup,0.0,Cardiff City,FA Cup,0.0,Tottenham Hotspur,FA Cup,0.0,Portsmouth,FA Cup,100.0
861,how many medals did austria win in the 2011 alpine skiing world championships,['8'],FIS Alpine World Ski Championships 2011,0.0,Schladming,FIS Alpine World Ski Championships 2011,0.0,Austria,FIS Alpine World Ski Championships 2011,-1.0,None,None,-1.0,None,None,-1.0,None,None,0.0,"runner-up was Schladming, Austria",FIS Alpine World Ski Championships 2011,1.0
862,how many ceos of fortune 500 companies are female,['32'],List of women CEOs of Fortune 500 companies,-1.0,None,None,0.0,5.2 percent,List of women CEOs of Fortune 500 companies,0.0,14,List of women CEOs of Fortune 500 companies,0.0,6.4 percent,List of women CEOs of Fortune 500 companies,0.0,7.4 percent,List of women CEOs of Fortune 500 companies,0.0,7.4 percent,List of women CEOs of Fortune 500 companies,1.0
863,how many episodes is season 4 of the flash,"['23', '19', '23 episodes']",The Flash (season 4),-1.0,None,None,-1.0,None,None,-1.0,None,None,0.0,two,The Flash (season 4),-1.0,None,None,100.0,23,The Flash (season 4),101.0
864,where did zendaya place in dancing with the stars,['Runner - up'],Dancing with the Stars (U.S. season 16),-1.0,None,None,0.0,week 3,Dancing with the Stars (U.S. season 16),0.0,did not learn Rumba,Dancing with the Stars (U.S. season 16),0.0,did not learn Rumba,Dancing with the Stars (U.S. season 16),-1.0,None,None,-1.0,None,None,1.0
865,in 1945 which party came into power in england,"['Labour Party', 'Labour', 'Conservative']","United Kingdom general election, 1945",100.0,Labour Party,"United Kingdom general election, 1945",100.0,Labour,"United Kingdom general election, 1945",100.0,Labour Party,"United Kingdom general election, 1945",100.0,Labour Party,"United Kingdom general election, 1945",-1.0,None,None,-1.0,None,None,101.0
866,does archie end up with betty or veronica in riverdale,"['neither issue made it clear whether Archie was married to Betty or Veronica', 'Betty']",Archie Marries Veronica/Archie Marries Betty,-1.0,None,None,100.0,Veronica,Archie Marries Veronica/Archie Marries Betty,100.0,Betty,Archie Marries Veronica/Archie Marries Betty,66.66666666666666,Archie Marries Betty,Archie Marries Veronica/Archie Marries Betty,100.0,Betty,Archie Marries Veronica/Archie Marries Betty,100.0,Betty,Archie Marries Veronica/Archie Marries Betty,101.0
867,who voices randy in f is for family,['T.J. Miller'],F Is for Family,-1.0,None,None,-1.0,None,None,0.0,Bill Burr,F Is for Family,0.0,Bill Burr,F Is for Family,0.0,Bill Burr,F Is for Family,0.0,Bill Burr,F Is for Family,1.0
868,how long did it take to build the great pyramid of egypt,"['a 10 - to 20 - year period', 'over a 10 - to 20 - year period', '20 - year period']",Great Pyramid of Giza,71.65313105737893,20 year period,Great Pyramid of Giza,75.0,10 to 20-year period,Great Pyramid of Giza,47.76875403825262,10 to 20-year,Great Pyramid of Giza,18.393972058572118,10 years,Great Pyramid of Giza,18.393972058572118,20-year period,Great Pyramid of Giza,18.393972058572118,20 years,Great Pyramid of Giza,56.60602794142788
869,oklahoma's 10 geographic regions are defined by surface features called,['ecological regions'],Geography of Oklahoma,-1.0,None,None,100.0,ecological regions,Geography of Oklahoma,100.0,ecological regions,Geography of Oklahoma,100.0,ecological regions,Geography of Oklahoma,100.0,ecological regions,Geography of Oklahoma,100.0,ecological regions,Geography of Oklahoma,101.0
870,what proposition made the insurance commissioner an elected position,"['Proposition 103 in 1988', 'Proposition 103']",California Insurance Commissioner,100.0,Proposition 103,California Insurance Commissioner,100.0,Proposition 103,California Insurance Commissioner,100.0,Proposition 103,California Insurance Commissioner,100.0,Proposition 103,California Insurance Commissioner,100.0,Proposition 103,California Insurance Commissioner,100.0,Proposition 103,California Insurance Commissioner,0.0
871,who's the original singer of help me make it through the night,['Kris Kristofferson'],Help Me Make It Through the Night,36.787944117144235,Kristofferson,Help Me Make It Through the Night,100.0,Kris Kristofferson,Help Me Make It Through the Night,100.0,Kris Kristofferson,Help Me Make It Through the Night,36.787944117144235,Kristofferson,Help Me Make It Through the Night,100.0,Kris Kristofferson,Help Me Make It Through the Night,100.0,Kris Kristofferson,Help Me Make It Through the Night,63.212055882855765
872,who was elected president of the united states in 1928,"['Herbert Hoover', 'Republican Secretary of Commerce Herbert Hoover']","United States presidential election, 1928",100.0,Herbert Hoover,"United States presidential election, 1928",23.076923076923077,"Herbert Hoover was nominated as the Republican candidate, as incumbent President Calvin Coolidge","United States presidential election, 1928",36.787944117144235,Hoover,"United States presidential election, 1928",100.0,Herbert Hoover,"United States presidential election, 1928",-1.0,None,None,-1.0,None,None,101.0
873,who played buffy the vampire slayer in the movie,['Kristy Swanson'],Buffy the Vampire Slayer (film),100.0,Kristy Swanson,Buffy the Vampire Slayer (film),25.0,"Kristy Swanson, Donald Sutherland",Buffy the Vampire Slayer (film),7.6923076923076925,"Kristy Swanson, Donald Sutherland, Paul Reubens, Rutger Hauer, Luke Perry and Hilary Swank",Buffy the Vampire Slayer (film),7.6923076923076925,"Kristy Swanson, Donald Sutherland, Paul Reubens, Rutger Hauer, Luke Perry, and Hilary Swank",Buffy the Vampire Slayer (film),40.0,Kristy Swanson and Paul Reubens,Buffy the Vampire Slayer (film),40.0,Kristy Swanson and Paul Reubens,Buffy the Vampire Slayer (film),92.3076923076923
874,who did the dominican republic gain its independence from,['Haiti'],Dominican War of Independence,100.0,Haiti,Dominican War of Independence,100.0,Haiti,Dominican War of Independence,100.0,Haiti,Dominican War of Independence,100.0,Haiti,Dominican War of Independence,100.0,Haiti,Dominican War of Independence,100.0,Haiti,Dominican War of Independence,0.0
875,who is playing the halftime show at super bowl 2016,"['Coldplay with special guest performers Beyoncé and Bruno Mars', 'British rock group Coldplay with special guest performers Beyoncé and Bruno Mars', 'Coldplay']",Super Bowl 50 halftime show,-1.0,None,None,-1.0,None,None,100.0,Coldplay,Super Bowl 50 halftime show,100.0,Coldplay,Super Bowl 50 halftime show,100.0,Coldplay,Super Bowl 50 halftime show,100.0,Coldplay,Super Bowl 50 halftime show,101.0
876,when did the first battle of ypres end,['22 November 1914'],Battle of Ypres,0.0,four,Battle of Ypres,0.0,five,Battle of Ypres,0.0,First World War,Battle of Ypres,0.0,five,Battle of Ypres,0.0,five,Battle of Ypres,0.0,five,Battle of Ypres,0.0
877,who is the supreme justice of the supreme court,['John Roberts'],Chief Justice of the United States,0.0,The Chief Justice,Chief Justice of the United States,50.0,John Marshall,Chief Justice of the United States,0.0,The Chief Justice,Chief Justice of the United States,100.0,John Roberts,Chief Justice of the United States,100.0,John Roberts,Chief Justice of the United States,100.0,John Roberts,Chief Justice of the United States,100.0
878,under the federal unemployment tax act which party pays unemployment taxes,"['the employer', 'Employers']",Federal Unemployment Tax Act,25.0,state workforce agencies. Employers,Federal Unemployment Tax Act,20.0,employer tax used to help fund state workforce agencies. Employers,Federal Unemployment Tax Act,100.0,Employers,Federal Unemployment Tax Act,100.0,employer,Federal Unemployment Tax Act,100.0,employer,Federal Unemployment Tax Act,100.0,employer,Federal Unemployment Tax Act,80.0
879,who is the winner of bigg boss kannada season,"['rapper Chandan Shetty', 'Chandan Shetty']",Bigg Boss Kannada 5,-1.0,None,None,-1.0,None,None,-1.0,None,None,100.0,Chandan Shetty,Bigg Boss Kannada 5,-1.0,None,None,-1.0,None,None,101.0
880,communities of similar organisms found in a particular environment are called,"['habitat', 'species']",Habitat,0.0,biotope,Habitat,50.0,Monotypic habitat,Habitat,0.0,Microhabitat,Habitat,0.0,biotope,Habitat,0.0,biotope,Habitat,0.0,biotope,Habitat,50.0
881,when did the movie napoleon dynamite come out,"['2004', 'June 11 , 2004']",Napoleon Dynamite,100.0,2004,Napoleon Dynamite,100.0,2004,Napoleon Dynamite,100.0,2004,Napoleon Dynamite,100.0,2004,Napoleon Dynamite,100.0,2004,Napoleon Dynamite,100.0,2004,Napoleon Dynamite,0.0
882,where are haploid cells found in the human body,"['gametes ( sperm or egg cells )', 'sperm or egg cells', 'sperm']",Ploidy,40.0,sex cells (sperm and egg,Ploidy,100.0,gametes,Ploidy,100.0,gametes,Ploidy,50.0,somatic cells,Ploidy,50.0,somatic cells,Ploidy,50.0,somatic cells,Ploidy,60.0
883,who played the virgin in conan the destroyer,"[""Olivia d'Abo""]",Conan the Destroyer,0.0,Richard Fleischer,Conan the Destroyer,0.0,Arnold Schwarzenegger,Conan the Destroyer,100.0,Olivia d'Abo,Conan the Destroyer,2.2471910112359548,"Wilt Chamberlain, Tracey Walter, and Olivia d'Abo. It is the sequel to ""Conan the Barbarian"". The film grossed $31 million in the US.
Plot.
Conan (Schwarzenegger) and his companion, the thief Malak (Walter), are confronted by Queen Taramis (Sarah Douglas) of Shadizar. She tests their combat ability with several of her guards. Satisfied, she tells Conan that she has a quest for him. He refuses her, but when she promises to resurrect his lost love, Valeria, Conan agrees to the quest. He is to escort the Queen's niece, Jehnna (Olivia d'Abo",Conan the Destroyer,0.0,Jones,Conan the Destroyer,0.0,Sarah Douglas,Conan the Destroyer,100.0
884,what was the most important new religious figure of the new kingdom of ancient egypt,"['the Aten , a representation of the Egyptian god , Ra', 'Aten']",New Kingdom of Egypt,-1.0,None,None,13.333333333333334,"Amenhotep IV, who changed his name to Akhenaten in honor of the Aten and whose exclusive worship of the Aten is often interpreted as history's first instance of monotheism. Akhenaten",New Kingdom of Egypt,13.333333333333334,"Amenhotep IV, who changed his name to Akhenaten in honor of the Aten and whose exclusive worship of the Aten is often interpreted as history's first instance of monotheism. Akhenaten",New Kingdom of Egypt,25.0,"Akhenaten in honor of the Aten , a representation of the Egyptian god, Ra. His exclusive worship of the Aten is often interpreted as history's first instance of monotheism. Akhenaten's wife, Nefertiti",New Kingdom of Egypt,0.0,Akhenaten,New Kingdom of Egypt,0.0,Philistia,New Kingdom of Egypt,26.0
885,who sang the song oh what a lonely boy,['Andrew Gold'],Lonely Boy (Andrew Gold song),0.0,Linda Ronstadt,Lonely Boy (Andrew Gold song),36.787944117144235,Gold,Lonely Boy (Andrew Gold song),0.0,Linda Ronstadt,Lonely Boy (Andrew Gold song),100.0,Andrew Gold,Lonely Boy (Andrew Gold song),100.0,Andrew Gold,Lonely Boy (Andrew Gold song),100.0,Andrew Gold,Lonely Boy (Andrew Gold song),100.0
886,where did you go to drink during prohibition,['Speakeasies'],Prohibition in the United States,0.0,saloons,Prohibition in the United States,0.0,townships or counties,Prohibition in the United States,0.0,New York City,Prohibition in the United States,0.0,saloons or taverns,Prohibition in the United States,0.0,New York City,Prohibition in the United States,0.0,saloons or taverns,Prohibition in the United States,0.0
887,who wrote when a man loves a woman,"['Percy Sledge', 'Calvin Lewis and Andrew Wright', 'Calvin Lewis']",When a Man Loves a Woman (song),100.0,Percy Sledge,When a Man Loves a Woman (song),100.0,Calvin Lewis and Andrew Wright,When a Man Loves a Woman (song),100.0,Calvin Lewis and Andrew Wright,When a Man Loves a Woman (song),100.0,Calvin Lewis and Andrew Wright,When a Man Loves a Woman (song),100.0,Calvin Lewis and Andrew Wright,When a Man Loves a Woman (song),100.0,Calvin Lewis and Andrew Wright,When a Man Loves a Woman (song),0.0
888,what is the order of the netflix marvel shows,"[""Marvel 's Daredevil""]",List of Marvel Cinematic Universe television series,-1.0,None,None,0.0,one series,List of Marvel Cinematic Universe television series,0.0,four series,List of Marvel Cinematic Universe television series,0.0,straight-to-series,List of Marvel Cinematic Universe television series,33.33333333333333,"Marvel Knights"" series",List of Marvel Cinematic Universe television series,0.0,six hour-long films,List of Marvel Cinematic Universe television series,34.33333333333333
889,where did they live in sex and the city,['New York City'],Sex and the City,2.6666666666666665,"New York City, the show's focus is on four female characters. It was considered a sitcom, but had serialized storylines, like a soap opera, as well as dramatic elements. The show tackled socially relevant issues, often specifically dealing with women in society in the late 1990s, and how changing roles and definitions for women affected the characters. 
The show was primarily filmed at New York City's Silvercup Studios and on location in and around Manhattan",Sex and the City,100.0,New York City,Sex and the City,100.0,New York City,Sex and the City,100.0,New York City,Sex and the City,100.0,New York City,Sex and the City,100.0,New York City,Sex and the City,97.33333333333333
890,who declared war on the united states four days after pearl harbor,['Nazi Germany'],Consequences of the attack on Pearl Harbor,-1.0,None,None,40.0,Nazi Germany and Fascist Italy,Consequences of the attack on Pearl Harbor,40.0,Nazi Germany and Fascist Italy,Consequences of the attack on Pearl Harbor,40.0,Nazi Germany and Fascist Italy,Consequences of the attack on Pearl Harbor,40.0,Nazi Germany and Fascist Italy,Consequences of the attack on Pearl Harbor,40.0,Nazi Germany and Fascist Italy,Consequences of the attack on Pearl Harbor,41.0
891,when did earth's atmosphere change due to living organisms,"['around 2.45 billion years ago', 'around 2.45 billion years ago ( 2.45 Ga ) , during the Siderian period , at the beginning of the Proterozoic eon']",Great Oxygenation Event,-1.0,None,None,58.41005873035536,2.3 billion years ago,Great Oxygenation Event,58.41005873035536,2.3 billion years ago,Great Oxygenation Event,55.84225390176649,"around 2.45 billion years ago (2.45 Ga), during the Siderian period, at the beginning of the Proterozoic eon",Great Oxygenation Event,-1.0,None,None,-1.0,None,None,59.41005873035536
892,latest series of keeping up with the kardashians,['14'],List of Keeping Up with the Kardashians episodes,-1.0,None,None,0.0,2007,List of Keeping Up with the Kardashians episodes,0.0,2007,List of Keeping Up with the Kardashians episodes,0.0,fourteen season,List of Keeping Up with the Kardashians episodes,0.0,Kanye West became a recurring cast member after entering into a relationship with Kim. West later developed a more prominent role from season 16,List of Keeping Up with the Kardashians episodes,0.0,season 16,List of Keeping Up with the Kardashians episodes,1.0
893,where is arachidonic acid found in the body,['brain'],Arachidonic acid,5.555555555555554,"phospholipids (especially phosphatidylethanolamine, phosphatidylcholine and phosphatidylinositides) of membranes of the body's cells, and is abundant in the brain",Arachidonic acid,0.0,bone marrow,Arachidonic acid,0.0,How it is metabolized,Arachidonic acid,5.555555555555554,"phospholipids (especially phosphatidylethanolamine, phosphatidylcholine, and phosphatidylinositides) of membranes of the body's cells, and is abundant in the brain",Arachidonic acid,0.0,How it is metabolized,Arachidonic acid,0.0,How it is metabolized,Arachidonic acid,5.555555555555554
894,who played the first phantom of the opera,['Michael Crawford'],The Phantom of the Opera (1986 musical),100.0,Michael Crawford,The Phantom of the Opera (1986 musical),100.0,Michael Crawford,The Phantom of the Opera (1986 musical),0.0,Colm Wilkinson,The Phantom of the Opera (1986 musical),100.0,Michael Crawford,The Phantom of the Opera (1986 musical),0.0,Colm Wilkinson,The Phantom of the Opera (1986 musical),0.0,Colm Wilkinson,The Phantom of the Opera (1986 musical),100.0
895,what is the purpose of the bromophenol blue dye in the samples,"['as a pH indicator', 'a pH indicator']",Bromophenol blue,33.33333333333333,a color marker,Bromophenol blue,33.33333333333333,"a pH indicator, a color marker",Bromophenol blue,33.33333333333333,"a pH indicator, a color marker",Bromophenol blue,37.5,"used as a pH indicator, a color marker",Bromophenol blue,33.33333333333333,"used as a pH indicator, an electrophoretic color marker",Bromophenol blue,33.33333333333333,"used as a pH indicator, an electrophoretic color marker",Bromophenol blue,4.166666666666671
896,who became a leader of the indian national congress,['Mahatma Gandhi'],Indian National Congress,50.0,Rajiv Gandhi,Indian National Congress,50.0,Indira Gandhi,Indian National Congress,50.0,Indira Gandhi,Indian National Congress,50.0,Rajiv Gandhi,Indian National Congress,100.0,Mahatma Gandhi,Indian National Congress,0.0,Jawaharlal Nehru,Indian National Congress,100.0
897,when did the nba add the three point line,"['1979 -- 80', 'the 1979 -- 80 season', 'In the 1979 -- 80 season', '1979 -- 80 season']",Three-point field goal,0.0,1968,Three-point field goal,0.0,1986,Three-point field goal,30.326532985631673,1979–80 season,Three-point field goal,0.0,1961,Three-point field goal,0.0,1961,Three-point field goal,30.326532985631673,June 1979,Three-point field goal,30.326532985631673
898,how many pennsylvania house of representatives are there,"['203', '203 members']",Pennsylvania House of Representatives,100.0,203,Pennsylvania House of Representatives,100.0,203,Pennsylvania House of Representatives,100.0,203,Pennsylvania House of Representatives,100.0,203,Pennsylvania House of Representatives,100.0,203,Pennsylvania House of Representatives,100.0,203,Pennsylvania House of Representatives,0.0
899,what does istj mean in a personality test,['Introverted Sensing ( Si )'],ISTJ,38.94003915357025,Introverted Sensing Thinking Judging,ISTJ,0.0,"introversion, sensing, thinking, judgment",ISTJ,0.0,"introversion, sensing, thinking, judgment",ISTJ,5.555555555555554,"By functions; Introverted Sensing (Si), Extroverted Thinking (Te), Introverted Feeling (Fi) and Extroverted Intuition (Ne)) is an abbreviation used in the publications of the Myers–Briggs Type Indicator (MBTI) to refer to one of sixteen personality types",ISTJ,-1.0,None,None,-1.0,None,None,39.94003915357025
900,when does elena turn into a vampire in the tv series,"[""In the television series 's fourth season"", 'fourth season', 'season four']",Elena Gilbert,-1.0,None,None,100.0,fourth season,Elena Gilbert,100.0,fourth season,Elena Gilbert,100.0,fourth season,Elena Gilbert,100.0,fourth season,Elena Gilbert,100.0,fourth season,Elena Gilbert,101.0
