,Question,GT Answer,GT Topic,2008 Bleu Score,2008 Predicted,2008 Topic,2014 Bleu Score,2014 Predicted,2014 Topic,2016 Bleu Score,2016 Predicted,2016 Topic,2018 Bleu Score,2018 Predicted,2018 Topic,2020 Bleu Score,2020 Predicted,2020 Topic,2021 Bleu Score,2021 Predicted,2021 Topic,max - min
0,what are the main crops grown in the united states,['Corn'],Agriculture in the United States,0.0,"Corn, turkeys, tomatoes, potatoes, peanuts, and sunflower seeds",Agriculture in the United States,0.0,"Corn, turkeys, tomatoes, potatoes, peanuts, and sunflower seeds",Agriculture in the United States,0.0,"fruits, vegetables, grains, and fiber crops",Agriculture in the United States,0.0,"fruits, vegetables, grains, and fiber crops",Agriculture in the United States,0.0,"Corn, turkeys, tomatoes, potatoes, peanuts, and sunflower seeds",Agriculture in the United States,0.0,"Corn, turkeys, tomatoes, potatoes, peanuts, and sunflower seeds",Agriculture in the United States,0.0
1,who is the owner of the mandalay bay in vegas,['MGM Resorts International'],Mandalay Bay,-1.0,None,None,100.0,MGM Resorts International,Mandalay Bay,100.0,MGM Resorts International,Mandalay Bay,100.0,MGM Resorts International,Mandalay Bay,60.653065971263345,MGM Resorts,Mandalay Bay,30.326532985631673,MGM Mirage,Mandalay Bay,101.0
2,what is the shannara chronicles season 2 based on,['The Sword of Shannara Trilogy'],The Shannara Chronicles,-1.0,None,None,-1.0,None,None,38.94003915357025,"The Elfstones of Shannara"",",The Shannara Chronicles,27.27272727272727,"The Sword of Shannara"" trilogy of fantasy novels by Terry Brooks",The Shannara Chronicles,-1.0,None,None,37.5,"The Sword of Shannara"" trilogy of fantasy novels",The Shannara Chronicles,39.94003915357025
3,when did michigan last win a national championship,['1989'],Michigan Wolverines men's basketball,-1.0,None,None,0.0,2013,Michigan Wolverines men's basketball,0.0,2013,Michigan Wolverines men's basketball,0.0,2013,Michigan Wolverines men's basketball,0.0,2013,Michigan Wolverines men's basketball,0.0,2013,Michigan Wolverines men's basketball,1.0
4,who owns the majority of the us debt,"['Japan and China', 'China', 'the public', 'Japan']",National debt of the United States,-1.0,None,None,100.0,China,National debt of the United States,100.0,the public,National debt of the United States,100.0,the public,National debt of the United States,100.0,the public,National debt of the United States,100.0,the public,National debt of the United States,101.0
5,types of skiing in the winter olympics 2018,['Downhill'],Alpine skiing at the 2018 Winter Olympics,-1.0,None,None,-1.0,None,None,-1.0,None,None,0.0,Alpine skiing at the 2018 Winter Olympics is scheduled for 12 to 24 February at Yongpyong Alpine Centre (slalom and giant slalom,Alpine skiing at the 2018 Winter Olympics,-1.0,None,None,0.0,Alpine skiing at the 2018 Winter Olympics was held from 12 to 24 February at Yongpyong Alpine Centre (slalom and giant slalom,Alpine skiing at the 2018 Winter Olympics,1.0
6,who did the 49ers beat in the super bowls,['Cincinnati Bengals'],San Francisco 49ers,0.0,Dallas Cowboys,San Francisco 49ers,0.0,Dallas Cowboys,San Francisco 49ers,0.0,Miami Dolphins,San Francisco 49ers,0.0,Dallas Cowboys,San Francisco 49ers,0.0,Dallas Cowboys,San Francisco 49ers,0.0,Washington Redskins,San Francisco 49ers,0.0
7,when was the south asian association for regional co-operation (saarc) formed,"['8 December 1985', 'December 1985']",South Asian Association for Regional Cooperation,66.66666666666666,"December 8, 1985",South Asian Association for Regional Cooperation,36.787944117144235,1985,South Asian Association for Regional Cooperation,100.0,8 December 1985,South Asian Association for Regional Cooperation,100.0,8 December 1985,South Asian Association for Regional Cooperation,100.0,8 December 1985,South Asian Association for Regional Cooperation,100.0,8 December 1985,South Asian Association for Regional Cooperation,63.212055882855765
8,new york heart association functional classification of angina,['II'],New York Heart Association Functional Classification,0.0,New York Heart Association (NYHA) Functional Classification,New York Heart Association Functional Classification,-1.0,None,None,0.7462686567164181,"New York Heart Association (NYHA) Functional Classification provides a simple way of classifying the extent of heart failure. It places patients in one of four categories based on how much they are limited during physical activity; the limitations/symptoms are in regard to normal breathing and varying degrees in shortness of breath and/or angina pain.
It originated in 1928, when no measurements of cardiac function were possible, to provide a common language for physicians to communicate. Despite difficulties in applying it, such as the challenge of consistently classifying patients in class II or III, because functional capacity is such a powerful determinant of outcome it remains arguably the most important prognostic marker in routine clinical use in heart failure today.
Another frequently used functional classification of cardiovascular disease is the Canadian Cardiovascular Society grading of angina pectoris",New York Heart Association Functional Classification,-1.0,None,None,0.7518796992481204,"New York Heart Association (NYHA) Functional Classification provides a simple way of classifying the extent of heart failure. It places patients in one of four categories based on how much they are limited during physical activity; the limitations/symptoms are in regard to normal breathing and varying degrees in shortness of breath and/or angina.
It originated in 1902, when no measurements of cardiac function were possible, to provide a common language for physicians to communicate. Despite difficulties in applying it, such as the challenge of consistently classifying patients in class II or III, because functional capacity is such a powerful determinant of outcome it remains arguably the most important prognostic marker in routine clinical use in heart failure today.
Another frequently used functional classification of cardiovascular disease is the Canadian Cardiovascular Society grading of angina pectoris",New York Heart Association Functional Classification,0.5681818181818185,"New York Heart Association (NYHA) Functional Classification provides a simple way of classifying the extent of heart failure. It places patients in one of four categories based on how much they are limited during physical activity; the limitations/symptoms are in regard to normal breathing and varying degrees in shortness of breath and/or angina.
It originated in 1928, when no measurements of cardiac function were possible, to provide a common language for physicians to communicate. Despite difficulties in applying it, such as the challenge of consistently classifying patients in class II or III, because functional capacity is such a powerful determinant of outcome it remains arguably the most important prognostic marker in routine clinical use in heart failure today. With time the classification system evolved and updated multiple times. Presently, the ninth edition of the NYHA classification is being used in the clinical practice released in the year 1994 by the Criteria Committee of the American Heart Association, New York City Affiliate.
Another frequently used functional classification of cardiovascular disease is the Canadian Cardiovascular Society grading of angina pectoris",New York Heart Association Functional Classification,1.7518796992481205
9,is jaffa cakes a biscuit or a cake,"['cakes', 'the Jaffa cake should be considered a cake for tax purposes', 'biscuit - sized cakes', 'Cake']",Jaffa Cakes,100.0,cakes,Jaffa Cakes,100.0,cake,Jaffa Cakes,100.0,cake,Jaffa Cakes,100.0,cake,Jaffa Cakes,100.0,cake,Jaffa Cakes,100.0,cake,Jaffa Cakes,0.0
10,how long was dark side of the moon number 1,"['42 : 49', 'a week']",The Dark Side of the Moon,50.0,one week,The Dark Side of the Moon,100.0,a week,The Dark Side of the Moon,100.0,a week,The Dark Side of the Moon,100.0,a week,The Dark Side of the Moon,100.0,a week,The Dark Side of the Moon,100.0,a week,The Dark Side of the Moon,50.0
11,where is the snooker world open currently held,"['Haikou', 'in Haikou on the Hainan Island', 'Hainan International Exhibition Center']",World Open (snooker),-1.0,None,None,100.0,Haikou on the Hainan Island,World Open (snooker),100.0,Haikou on the Hainan Island,World Open (snooker),100.0,Haikou on the Hainan Island,World Open (snooker),33.33333333333333,Scotland at the A.E.C.C. in Aberdeen,World Open (snooker),33.33333333333333,Scotland at the A.E.C.C. in Aberdeen,World Open (snooker),101.0
12,who sings the theme song for degrassi the next generation,['Jakalope'],List of Degrassi soundtracks,-1.0,None,None,-1.0,None,None,-1.0,None,None,0.0,Drake,List of Degrassi soundtracks,-1.0,None,None,0.0,Drake,List of Degrassi soundtracks,1.0
13,when did the first ice age come out,"['March 15 , 2002', '2002']",Ice Age (franchise),-1.0,None,None,100.0,2002,Ice Age (franchise),100.0,2002,Ice Age (franchise),100.0,2002,Ice Age (franchise),100.0,2002,Ice Age (franchise),100.0,2002,Ice Age (franchise),101.0
14,who does dwyane wade play for right now,"['the Miami Heat', 'the Miami Heat of the National Basketball Association ( NBA )', 'Miami Heat']",Dwyane Wade,100.0,Miami Heat,Dwyane Wade,100.0,Miami Heat,Dwyane Wade,100.0,Miami Heat,Dwyane Wade,100.0,Miami Heat,Dwyane Wade,100.0,Miami Heat,Dwyane Wade,100.0,Miami Heat,Dwyane Wade,0.0
15,who did johnny manziel play college football for,"['Texas A&M', 'Texas A&M University', 'Texas A&M Aggies']",Johnny Manziel,-1.0,None,None,66.66666666666666,Texas A&amp;M Aggies,Johnny Manziel,66.66666666666666,Texas A&amp;M Aggies,Johnny Manziel,50.0,Texas A&amp;M,Johnny Manziel,66.66666666666666,Texas A&amp;M University,Johnny Manziel,66.66666666666666,Texas A&amp;M Aggies,Johnny Manziel,67.66666666666666
16,india south africa test series 2018 highest runs,"['AB de Villiers', '286']",Indian cricket team in South Africa in 2017–18,-1.0,None,None,-1.0,None,None,-1.0,None,None,13.043478260869565,AB de Villiers was ruled out of South Africa's squad for the T20I series after suffering an injury before the fifth ODI match.,Indian cricket team in South Africa in 2017–18,-1.0,None,None,0.0,558,Indian cricket team in South Africa in 2017–18,14.043478260869565
17,who was last person to be executed in us,['Ruben Cardenas Ramirez'],List of offenders executed in the United States in 2017,-1.0,None,None,-1.0,None,None,-1.0,None,None,0.0,Marcel Williams,List of offenders executed in the United States in 2017,0.0,Jack Harold Jones,List of offenders executed in the United States in 2017,0.0,Jack Harold Jones,List of offenders executed in the United States in 2017,1.0
18,when was united nations convention on the rights of the child created,['20 November 1989'],Convention on the Rights of the Child,13.53352832366127,1989,Convention on the Rights of the Child,0.0,1991,Convention on the Rights of the Child,13.53352832366127,1989,Convention on the Rights of the Child,0.0,16 December 1991,Convention on the Rights of the Child,13.53352832366127,1989,Convention on the Rights of the Child,13.53352832366127,1989,Convention on the Rights of the Child,13.53352832366127
19,tallest building in the world of all time,['Burj Khalifa'],History of the world's tallest buildings,-1.0,None,None,-1.0,None,None,-1.0,None,None,100.0,Burj Khalifa,History of the world's tallest buildings,100.0,Burj Khalifa,History of the world's tallest buildings,100.0,Burj Khalifa,History of the world's tallest buildings,101.0
20,who plays chummy's mother in call the midwife,['Cheryl Campbell'],List of Call the Midwife characters,-1.0,None,None,-1.0,None,None,0.0,Jane,List of Call the Midwife characters,0.0,Patsy,List of Call the Midwife characters,0.0,Jane,List of Call the Midwife characters,0.0,Jane,List of Call the Midwife characters,1.0
21,who was the nfl first draft pick 2017,['Myles Garrett'],2017 NFL Draft,-1.0,None,None,-1.0,None,None,-1.0,None,None,0.0,Philadelphia,2017 NFL Draft,0.0,2017 NFL Draft was the 82nd annual meeting of National Football League (NFL) franchises to select newly eligible American football players,2017 NFL Draft,0.0,2017 NFL Draft was the 82nd annual meeting of National Football League (NFL) franchises to select newly eligible American football players,2017 NFL Draft,1.0
22,when did the song rapper's delight come out,"['September 16 , 1979', '1979']",Rapper's Delight,100.0,1979,Rapper's Delight,100.0,1979,Rapper's Delight,100.0,1979,Rapper's Delight,100.0,September 1979,Rapper's Delight,100.0,1979,Rapper's Delight,100.0,1979,Rapper's Delight,0.0
23,who won the mens single ice skating 2018,['Yuzuru Hanyu'],Figure skating at the 2018 Winter Olympics – Men's singles,-1.0,None,None,-1.0,None,None,-1.0,None,None,100.0,Yuzuru Hanyu,Figure skating at the 2018 Winter Olympics – Men's singles,100.0,Yuzuru Hanyu,Figure skating at the 2018 Winter Olympics – Men's singles,100.0,Yuzuru Hanyu,Figure skating at the 2018 Winter Olympics – Men's singles,101.0
24,what is the name of governor of maharashtra,['Chennamaneni Vidyasagar Rao'],List of governors of Maharashtra,-1.0,None,None,-1.0,None,None,0.0,Executive Head of the State of Maharashtra,List of governors of Maharashtra,0.0,The Governor of Maharashtra is the Executive Head of the State of Maharashtra,List of governors of Maharashtra,0.0,Bhagat Singh Koshiyari,List of governors of Maharashtra,0.0,Bhagat Singh Koshiyari,List of governors of Maharashtra,1.0
25,who was the first indian to be appointed as a judge in the international court of justice,['Sir Benegal Narsing Rau'],Judges of the International Court of Justice,0.0,!State!!Judge !!Judge!!President!!Vice-Pres,Judges of the International Court of Justice,0.0,ad hoc,Judges of the International Court of Justice,0.0,the first judge,Judges of the International Court of Justice,0.0,the first judge,Judges of the International Court of Justice,-1.0,None,None,0.0,the first judge,Judges of the International Court of Justice,1.0
26,when do the new episodes of supernatural start,"['May 10 , 2018']",Supernatural (season 13),-1.0,None,None,-1.0,None,None,-1.0,None,None,0.0,"October 12, 2017",Supernatural (season 13),-1.0,None,None,0.0,"October 12, 2017",Supernatural (season 13),1.0
27,when was the first season of when calls the heart,"['January 11 , 2014', '2014']",When Calls the Heart,-1.0,None,None,-1.0,None,None,0.0,When Calls the Heart,When Calls the Heart,0.0,October 2013,When Calls the Heart,0.0,2015,When Calls the Heart,100.0,2014,When Calls the Heart,101.0
28,where are the next two winter olympics going to be held,['Beijing'],List of Olympic Games host cities,-1.0,None,None,0.0,Oceania,List of Olympic Games host cities,100.0,Beijing,List of Olympic Games host cities,100.0,Beijing,List of Olympic Games host cities,9.09090909090909,Pyeongchang) (2018 Winter Olympics and 2024 Winter Youth Olympics) and Beijing,List of Olympic Games host cities,3.125,"Beijing for the 2022 Winter Olympics, Paris for the 2024 Summer Olympics, Milan–Cortina for the 2026 Winter Olympics, Los Angeles for the 2028 Summer Olympics, and Brisbane for the 2032 Summer Olympics",List of Olympic Games host cities,101.0
29,when did i'm coming out come out,"['August 22 , 1980']",I'm Coming Out,4.978706836786395,1980,I'm Coming Out,4.978706836786395,1980,I'm Coming Out,47.76875403825262,"August 22, 1980",I'm Coming Out,47.76875403825262,"August 22, 1980",I'm Coming Out,47.76875403825262,"August 22, 1980",I'm Coming Out,47.76875403825262,"August 22, 1980",I'm Coming Out,42.79004720146622
30,what type of bridge is the charles bridge,"['a bow bridge with 16 arches', 'bow bridge', 'a bow bridge', 'Stone']",Charles Bridge,0.0,historical,Charles Bridge,12.500000000000004,"solid-land"" connection made Prague important as a trade route between Eastern and Western Europe.
The bridge is 621 m long and nearly 10 m wide, resting on 16 arches shielded by ice guards",Charles Bridge,2.5,"baroque-style, originally erected around 1700 but now all replaced by replicas.
History.
Through the 19th century.
Throughout its history, the Charles Bridge suffered several disasters and witnessed many historic events. Czech legend has it that construction began on Charles Bridge at 5:31am on 9 July 1357 with the first stone being laid by Charles IV himself. This exact time was very important to the Holy Roman Emperor because he was a strong believer of numerology and this specific time, which formed a numerical",Charles Bridge,100.0,bow bridge,Charles Bridge,100.0,bow bridge,Charles Bridge,100.0,bow bridge,Charles Bridge,100.0
31,who did dwight howard play for last year,"['Atlanta Hawks', 'Charlotte Hornets of the National Basketball Association ( NBA )', 'Charlotte Hornets']",Dwight Howard,50.0,Charlotte Bobcats,Dwight Howard,5.263157894736841,"Orlando in the 2006–07 season, and for the third consecutive season he played in all 82 regular season games",Dwight Howard,6.25,"2006–07 season, and for the third consecutive season he played in all 82 regular season games",Dwight Howard,100.0,Charlotte Hornets,Dwight Howard,0.0,Los Angeles Lakers,Dwight Howard,100.0,Atlanta Hawks,Dwight Howard,100.0
32,who lasted the longest in the royal rumble,['Rey Mysterio'],Royal Rumble,0.0,2002,Royal Rumble,0.0,Jim Duggan,Royal Rumble,22.22222222222222,"Shawn Michaels, Vince McMahon, Chris Benoit and Rey Mysterio",Royal Rumble,0.0,Females,Royal Rumble,0.0,one hour,Royal Rumble,0.0,The winner,Royal Rumble,22.22222222222222
33,what is the largest man made lake in the us,['Lake Oahe'],List of largest lakes of the United States by area,-1.0,None,None,0.0,"worlds-largest-lakes-in-world-acres-C1/, accessed 7 Mar 2011. The area given is the normal or average area of the lake. Some lakes fluctuate substantially. For those lakes partially in Canada or Mexico the area given for the lake is the total area, not just the part of the lake in the United States",List of largest lakes of the United States by area,0.0,National Atlas of the United States,List of largest lakes of the United States by area,0.0,55,List of largest lakes of the United States by area,0.0,55,List of largest lakes of the United States by area,0.0,55,List of largest lakes of the United States by area,1.0
34,state with highest population growth rate in india 2011,"['Meghalaya', 'Dadra and Nagar Haveli']",List of states and union territories of India by population,-1.0,None,None,100.0,Nagar Haveli,List of states and union territories of India by population,100.0,Nagar Haveli,List of states and union territories of India by population,100.0,Nagar Haveli,List of states and union territories of India by population,100.0,Dadra and Nagar Haveli,List of states and union territories of India by population,100.0,Dadra and Nagar Haveli,List of states and union territories of India by population,101.0
35,which city is called the manchester of north india,['Ahmedabad'],List of cities and towns in India by nicknames,-1.0,None,None,-1.0,None,None,-1.0,None,None,0.0,city nicknames,List of cities and towns in India by nicknames,0.0,Khetia,List of cities and towns in India by nicknames,-1.0,None,None,1.0
36,who won college basketball player of the year,['Jalen Brunson'],Naismith College Player of the Year,0.0,Lew Alcindor,Naismith College Player of the Year,0.0,"Lew Alcindor of the University of California, Los Angeles (UCLA) and Anne Donovan",Naismith College Player of the Year,0.0,"Lew Alcindor of the University of California, Los Angeles (UCLA) and Anne Donovan",Naismith College Player of the Year,0.0,"Lew Alcindor of the University of California, Los Angeles (UCLA) and Anne Donovan",Naismith College Player of the Year,0.0,Bill Walton,Naismith College Player of the Year,0.0,Bill Walton,Naismith College Player of the Year,0.0
37,where can the mona lisa be found today,"['at the Louvre Museum in Paris', 'Musée du Louvre , Paris', 'Louvre Museum in Paris', 'on permanent display at the Louvre Museum in Paris']",Mona Lisa,71.65313105737893,Musée du Louvre,Mona Lisa,23.88437701912631,The Louvre museum,Mona Lisa,36.787944117144235,Louvre Museum,Mona Lisa,36.787944117144235,Louvre Museum,Mona Lisa,18.393972058572118,"Louvre, Paris",Mona Lisa,25.0,Metropolitan Museum of Art,Mona Lisa,53.25915899880681
38,when was the last time someone won the super bowl back to back,['2004'],Super Bowl curse,-1.0,None,None,100.0,2004,Super Bowl curse,0.0,1993,Super Bowl curse,0.0,1992,Super Bowl curse,0.0,2005,Super Bowl curse,0.0,–93,Super Bowl curse,101.0
39,where did the last name edwards come from,"['arose separately in England and Wales', 'England']",Edwards (surname),100.0,Wales,Edwards (surname),100.0,England and Wales,Edwards (surname),-1.0,None,None,100.0,England and Wales,Edwards (surname),-1.0,None,None,100.0,England and Wales,Edwards (surname),101.0
40,who is mostly responsible for writing the declaration of independence,['Thomas Jefferson'],United States Declaration of Independence,50.0,Thomas Paine,United States Declaration of Independence,0.0,John Adams,United States Declaration of Independence,0.0,John Adams,United States Declaration of Independence,0.0,John Locke,United States Declaration of Independence,36.787944117144235,Jefferson,United States Declaration of Independence,0.0,John Adams,United States Declaration of Independence,50.0
41,who does april end up with on parks and rec,"['Andy', 'Andy Dwyer']",April Ludgate,-1.0,None,None,100.0,Andy Dwyer,April Ludgate,0.0,Eduardo,April Ludgate,100.0,Andy Dwyer,April Ludgate,100.0,Andy Dwyer,April Ludgate,100.0,Andy Dwyer,April Ludgate,101.0
42,what's the population of prince edward island,"['142,907 residents', '142,907']",Prince Edward Island,0.0,"135,851",Prince Edward Island,0.0,"145,855",Prince Edward Island,0.0,"140,204",Prince Edward Island,100.0,"142,907",Prince Edward Island,0.0,largely white,Prince Edward Island,0.0,largely white,Prince Edward Island,100.0
43,who is the quarterback for the green bay packers,['Aaron Rodgers'],List of Green Bay Packers starting quarterbacks,-1.0,None,None,-1.0,None,None,0.0,quarterbacks,List of Green Bay Packers starting quarterbacks,100.0,Aaron Rodgers,List of Green Bay Packers starting quarterbacks,100.0,Aaron Rodgers,List of Green Bay Packers starting quarterbacks,100.0,Aaron Rodgers,List of Green Bay Packers starting quarterbacks,101.0
44,who has appeared in the most royal rumbles,"[""Isaac Yankem / `` Diesel '' / Kane""]",Royal Rumble,0.0,15,Royal Rumble,0.0,Rock,Royal Rumble,0.0,"Shawn Michaels, Vince McMahon, Chris Benoit and Rey Mysterio",Royal Rumble,0.0,Kofi Kingston,Royal Rumble,0.0,men,Royal Rumble,0.0,30,Royal Rumble,0.0
45,when is the 5th round fa cup played,"['29 January 2018', '16 February 2018', 'February 2018']",2017–18 FA Cup,-1.0,None,None,-1.0,None,None,-1.0,None,None,100.0,29 January 2018,2017–18 FA Cup,-1.0,None,None,100.0,29 January 2018,2017–18 FA Cup,101.0
46,when is the season finale of designated survivor,"['May 16 , 2018']",Designated Survivor (season 2),-1.0,None,None,-1.0,None,None,-1.0,None,None,23.88437701912631,"May 11, 2017",Designated Survivor (season 2),-1.0,None,None,23.88437701912631,"May 11, 2017",Designated Survivor (season 2),24.88437701912631
47,who plays yoda in revenge of the sith,['Frank Oz'],Yoda,0.0,Palpatine,Yoda,0.0,Tom Kane,Yoda,100.0,Frank Oz,Yoda,100.0,Frank Oz,Yoda,100.0,Frank Oz,Yoda,100.0,Frank Oz,Yoda,100.0
48,where did the california gold rush take place,"['Sierra Nevada and Northern California goldfields', 'Sierra Nevada']",California Gold Rush,0.0,San Francisco,California Gold Rush,50.0,"Coloma, California",California Gold Rush,50.0,"Coloma, California",California Gold Rush,50.0,"Coloma, California",California Gold Rush,50.0,"Coloma, California",California Gold Rush,50.0,"Coloma, California",California Gold Rush,50.0
49,when does bill nye saves the world season 2 come out,"['December 29 , 2017']",Bill Nye Saves the World,-1.0,None,None,-1.0,None,None,-1.0,None,None,23.88437701912631,"June 15, 2017",Bill Nye Saves the World,47.76875403825262,"December 29, 2017",Bill Nye Saves the World,47.76875403825262,"December 29, 2017",Bill Nye Saves the World,48.76875403825262
50,who voiced mewtwo in pokemon the first movie,"['Philip Bartlett', 'Masachika Ichimura']",Pokémon: The First Movie,-1.0,None,None,-1.0,None,None,-1.0,None,None,-1.0,None,None,-1.0,None,None,-1.0,None,None,0.0
51,who owns the biggest house in beverly hills,['Anthony Pritzker'],List of largest houses in the Los Angeles metropolitan area,-1.0,None,None,-1.0,None,None,-1.0,None,None,-1.0,None,None,0.0,four,List of largest houses in the Los Angeles metropolitan area,0.0,four,List of largest houses in the Los Angeles metropolitan area,1.0
52,who sings you're welcome in moana credits,"['Lin - Manuel Miranda', 'Dwayne Johnson']",Moana (soundtrack),-1.0,None,None,-1.0,None,None,-1.0,None,None,100.0,Dwayne Johnson,Moana (soundtrack),100.0,Dwayne Johnson,Moana (soundtrack),100.0,Dwayne Johnson,Moana (soundtrack),101.0
53,who sang the american national anthem at the super bowl,['Pink'],List of national anthem performers at the Super Bowl,-1.0,None,None,0.0,Vikki Carr,List of national anthem performers at the Super Bowl,0.0,Vikki Carr,List of national anthem performers at the Super Bowl,0.0,Vikki Carr,List of national anthem performers at the Super Bowl,0.0,Vikki Carr,List of national anthem performers at the Super Bowl,0.0,Vikki Carr,List of national anthem performers at the Super Bowl,1.0
54,this inventor co-created the film fred ott’s sneeze,"['Fred Ott', 'Edison']",Fred Ott's Sneeze,0.0,William K.L. Dickson,Fred Ott's Sneeze,0.0,Dickson,Fred Ott's Sneeze,0.0,William K.L. Dickson,Fred Ott's Sneeze,0.0,William K.L. Dickson,Fred Ott's Sneeze,0.0,William K.L. Dickson,Fred Ott's Sneeze,0.0,William K.L. Dickson,Fred Ott's Sneeze,0.0
