,Question,GT Answer,GT Topic,2008 Bleu Score,2008 Predicted,2008 Topic,2014 Bleu Score,2014 Predicted,2014 Topic,2016 Bleu Score,2016 Predicted,2016 Topic,2018 Bleu Score,2018 Predicted,2018 Topic,2020 Bleu Score,2020 Predicted,2020 Topic,2021 Bleu Score,2021 Predicted,2021 Topic,max - min
615,the recipient of first jnanpith award was an author which language,['Malayalam'],Jnanpith Award,100.0,Malayalam,Jnanpith Award,0.0,Bengali,Jnanpith Award,0.0,Bengali,Jnanpith Award,100.0,Malayalam,Jnanpith Award,100.0,Malayalam,Jnanpith Award,100.0,Malayalam,Jnanpith Award,100.0
616,who has the most ncaa basketball tournament appearances,['Kentucky'],NCAA Division I Men's Basketball Tournament bids by school,-1.0,None,None,-1.0,None,None,-1.0,None,None,0.0,UTEP,NCAA Division I Men's Basketball Tournament bids by school,0.0,68,NCAA Division I Men's Basketball Tournament bids by school,0.0,"68 bids possible each year (32 automatic qualifiers, 36 at-large). Schools not currently in Division I are in italics (e.g. ""CCNY"") and some have appeared under prior names (e.g., UTEP",NCAA Division I Men's Basketball Tournament bids by school,1.0
617,who was the first territorial governor of oklahoma,['George Washington Steele'],List of Governors of Oklahoma,0.0,William C. Grimes,List of Governors of Oklahoma,0.0,Robert Martin and William C. Grimes,List of Governors of Oklahoma,30.326532985631673,George Nigh,List of Governors of Oklahoma,30.326532985631673,George Nigh,List of Governors of Oklahoma,-1.0,None,None,-1.0,None,None,31.326532985631673
618,what is the latest version of microsoft office 2010,"['14.0. 7182.5000', '14.0. 7182.5000 Click - to - Run']",Microsoft Office 2010,-1.0,None,None,0.0,14.0.7015.1000,Microsoft Office 2010,0.0,4734.1000,Microsoft Office 2010,0.0,64-bit,Microsoft Office 2010,0.0,14.0.4763.1000,Microsoft Office 2010,0.0,Microsoft Office 2011,Microsoft Office 2010,1.0
619,what nba team did derrick rose play for,['Chicago Bulls'],Derrick Rose,0.0,Mean Street Express,Derrick Rose,100.0,Chicago Bulls,Derrick Rose,100.0,Chicago Bulls,Derrick Rose,0.0,Cleveland Cavaliers,Derrick Rose,0.0,Detroit Pistons,Derrick Rose,0.0,New York Knicks,Derrick Rose,100.0
620,who wrote it's a long long way to pasadena,"['John Young', 'David Hemmings , Harry Vanda & George Young', 'David Hemmings']",Pasadena (song),-1.0,None,None,-1.0,None,None,-1.0,None,None,-1.0,None,None,-1.0,None,None,100.0,John Young,Pasadena (song),101.0
621,who rebuilt the temple after the babylonian captivity,"['Herod', 'Likely Zerubbabel , largely renovated by Herod the Great']",Second Temple,100.0,Zerubbabel,Second Temple,100.0,Herod the Great,Second Temple,66.66666666666666,Cyrus the Great,Second Temple,100.0,Herod,Second Temple,100.0,Herod the Great,Second Temple,100.0,Herod the Great,Second Temple,33.33333333333334
622,where will the next summer and winter olympics be held,"['Tokyo for the 2020 Summer Olympics , Beijing for the 2022 Winter Olympics', 'Tokyo']",List of Olympic Games host cities,-1.0,None,None,21.37267961433182,"Rio de Janeiro for the 2016 Summer Olympics, Pyeongchang",List of Olympic Games host cities,100.0,Beijing,List of Olympic Games host cities,100.0,Beijing,List of Olympic Games host cities,100.0,Beijing,List of Olympic Games host cities,100.0,Beijing,List of Olympic Games host cities,101.0
623,when did ole miss beat alabama in football,"['October 27 , 1894']",Alabama–Ole Miss football rivalry,-1.0,None,None,0.0,1992 season,Alabama–Ole Miss football rivalry,0.0,1992,Alabama–Ole Miss football rivalry,0.0,1989,Alabama–Ole Miss football rivalry,0.0,1988,Alabama–Ole Miss football rivalry,0.0,1988,Alabama–Ole Miss football rivalry,1.0
624,what is the main mineral in lithium batteries,"['lithium', 'Lithium']",Lithium,50.0,lithium metal,Lithium,50.0,lithium carbonate,Lithium,50.0,lithium carbonate,Lithium,0.0,pegmatitic,Lithium,50.0,lithium hydroxide,Lithium,0.0,pegmatitic minerals,Lithium,50.0
625,who invented the first computer game in 1962 and what was the name of the game,['Spacewar !'],Spacewar!,0.0,Russell,Spacewar!,-1.0,None,None,-1.0,None,None,36.787944117144235,Spacewar,Spacewar!,0.0,Steve Russell,Spacewar!,0.0,Steve Russell,Spacewar!,37.787944117144235
626,what is the job of justice of the peace,"['dispense summary justice', 'a judicial officer , of a lower or puisne court , elected or appointed by means of a commission ( letters patent ) to keep the peace .']",Justice of the peace,-1.0,None,None,100.0,a judicial officer,Justice of the peace,100.0,a judicial officer,Justice of the peace,100.0,a judicial officer,Justice of the peace,88.88888888888889,"a judicial officer of a lower or ""puisne"" court",Justice of the peace,88.88888888888889,"a judicial officer of a lower or ""puisne"" court",Justice of the peace,101.0
627,swan lake the sleeping beauty and the nutcracker are three famous ballets by,['Pyotr Ilyich Tchaikovsky'],The Sleeping Beauty (ballet),1.2658227848101267,"Swan Lake"", met with little enthusiasm at that stage of his career. The ballet scenario Tchaikovsky worked on was based on the Brothers Grimm version of Perrault's work entitled 'Dornröschen', which ends with the Princess' parents (the King and the Queen) having survived the 100 years sleep to celebrate the Princess' wedding to the Prince although Vsevolozhsky wisely incorporated some of Perrault's characters from other stories into the ballet, such as Puss in Boots and Little Red Riding Hood",The Sleeping Beauty (ballet),0.0,"Beauty and the Beast, Pretty Goldilocks and The White Cat",The Sleeping Beauty (ballet),0.0,"Beauty and the Beast, Pretty Goldilocks and The White Cat",The Sleeping Beauty (ballet),13.53352832366127,Tchaikovsky,The Sleeping Beauty (ballet),0.0,"Beauty and the Beast, Pretty Goldilocks and The White Cat",The Sleeping Beauty (ballet),0.0,little enthusiasm,The Sleeping Beauty (ballet),13.53352832366127
628,who sang rip it up and start again,"['Scottish post-punk band Orange Juice', 'Orange Juice']",Rip It Up (Orange Juice song),-1.0,None,None,0.0,Paul Quinn,Rip It Up (Orange Juice song),50.0,the band,Rip It Up (Orange Juice song),0.0,Beverley Knight,Rip It Up (Orange Juice song),-1.0,None,None,0.0,Beverley Knight,Rip It Up (Orange Juice song),51.0
629,who plays whitey bulger's girlfriend in black mass,"['actress Dakota Johnson', 'Dakota Johnson']",Black Mass (film),-1.0,None,None,100.0,Dakota Johnson,Black Mass (film),100.0,Dakota Johnson,Black Mass (film),100.0,Dakota Johnson,Black Mass (film),100.0,Dakota Johnson,Black Mass (film),100.0,Dakota Johnson,Black Mass (film),101.0
630,how many episodes are in season 7 of pretty little liars,['20'],Pretty Little Liars (season 7),-1.0,None,None,-1.0,None,None,100.0,20,Pretty Little Liars (season 7),100.0,20,Pretty Little Liars (season 7),-1.0,None,None,100.0,20,Pretty Little Liars (season 7),101.0
631,hazels boyfriend in the fault in our stars,"['Augustus Waters', '17 - year - old Augustus Waters , an ex-basketball player and amputee']",The Fault in Our Stars,-1.0,None,None,100.0,Augustus Waters,The Fault in Our Stars,100.0,Augustus Waters,The Fault in Our Stars,100.0,Augustus Waters,The Fault in Our Stars,100.0,Augustus Waters,The Fault in Our Stars,100.0,Augustus Waters,The Fault in Our Stars,101.0
632,who played the judge in good will hunting,['James P. Flynn'],Jimmy Flynn,100.0,James P. Flynn,Jimmy Flynn,13.53352832366127,Flynn,Jimmy Flynn,75.0,James P. Flynn'. Flynn,Jimmy Flynn,100.0,James P. Flynn,Jimmy Flynn,-1.0,None,None,100.0,James P. Flynn,Jimmy Flynn,101.0
633,aphasia is a term defining difficulty or loss of ability to,"['formulate language', 'comprehend and formulate language', 'comprehend and formulate language because of damage to specific brain regions']",Aphasia,50.0,produce and/or comprehend language,Aphasia,0.0,"speak, read, or write",Aphasia,20.0,produce any form of expressions,Aphasia,0.0,"speak, read, or write",Aphasia,0.0,"speak, read, or write",Aphasia,20.0,produce any form of expressions,Aphasia,50.0
634,where is the white castle that harold and kumar go to,['in Cherry Hill'],Harold & Kumar Go to White Castle,-1.0,None,None,-1.0,None,None,-1.0,None,None,-1.0,None,None,-1.0,None,None,-1.0,None,None,0.0
635,where was the first high level language operating system created,['at IBM'],History of programming languages,0.0,In the 1940s,History of programming languages,36.787944117144235,IBM,History of programming languages,36.787944117144235,IBM,History of programming languages,36.787944117144235,IBM,History of programming languages,36.787944117144235,IBM,History of programming languages,36.787944117144235,IBM,History of programming languages,36.787944117144235
636,when does i'm a celebrity get me out of here start in the uk,['2018'],I'm a Celebrity...Get Me Out of Here! (UK TV series),-1.0,None,None,0.0,16 November 2014,I'm a Celebrity...Get Me Out of Here! (UK TV series),0.0,2002,I'm a Celebrity...Get Me Out of Here! (UK TV series),0.0,NOW,I'm a Celebrity...Get Me Out of Here! (UK TV series),-1.0,None,None,-1.0,None,None,1.0
637,where will the first round of march madness be played,"['PPG Paints Arena , Pittsburgh , Pennsylvania ( Host : Duquesne University )', 'Duquesne University']",2018 NCAA Division I Men's Basketball Tournament,-1.0,None,None,-1.0,None,None,-1.0,None,None,0.0,First Four,2018 NCAA Division I Men's Basketball Tournament,0.0,Charlotte,2018 NCAA Division I Men's Basketball Tournament,0.0,Charlotte,2018 NCAA Division I Men's Basketball Tournament,1.0
638,what information is displayed in clear text from the ftp header,['all transmissions'],File Transfer Protocol,0.0,credentials and data,File Transfer Protocol,100.0,all transmissions,File Transfer Protocol,100.0,all transmissions,File Transfer Protocol,100.0,all transmissions,File Transfer Protocol,100.0,all transmissions,File Transfer Protocol,100.0,all transmissions,File Transfer Protocol,100.0
639,who died in the plane crash greys anatomy,"['Lexie', 'Dr. Lexie Grey', 'Dr. Lexie Grey ( Chyler Leigh )']",Flight (Grey's Anatomy),-1.0,None,None,100.0,Dr. Lexie Grey,Flight (Grey's Anatomy),100.0,Dr. Lexie Grey,Flight (Grey's Anatomy),100.0,Lexie,Flight (Grey's Anatomy),100.0,Dr. Lexie Grey,Flight (Grey's Anatomy),100.0,Dr. Lexie Grey,Flight (Grey's Anatomy),101.0
640,how much energy does coal produce in the us,"['30.4 %', '16.5 quadrillion BTUs']",Coal power in the United States,0.0,half,Coal power in the United States,100.0,16.5 quadrillion BTUs,Coal power in the United States,0.0,39%,Coal power in the United States,0.0,92.3%,Coal power in the United States,0.0,224.3 GW,Coal power in the United States,0.0,224.3 GW,Coal power in the United States,100.0
641,actor who played caesar in dawn of the planet of the apes,['Andy Serkis'],Dawn of the Planet of the Apes,-1.0,None,None,100.0,Andy Serkis,Dawn of the Planet of the Apes,100.0,Andy Serkis,Dawn of the Planet of the Apes,100.0,Andy Serkis,Dawn of the Planet of the Apes,100.0,Andy Serkis,Dawn of the Planet of the Apes,100.0,Andy Serkis,Dawn of the Planet of the Apes,101.0
642,when was where have all the flowers gone written,['1955'],Where Have All the Flowers Gone?,0.0,1960s,Where Have All the Flowers Gone?,100.0,1955,Where Have All the Flowers Gone?,100.0,1955,Where Have All the Flowers Gone?,100.0,1955,Where Have All the Flowers Gone?,100.0,1955,Where Have All the Flowers Gone?,100.0,1955,Where Have All the Flowers Gone?,100.0
643,where do the phaeacians live in the odyssey,"['Scheria', 'Scheria ( / ˈskɛriə / ; Ancient Greek : Σχερίη or Σχερία ) -- also known as Scherie or Phaeacia']",Scheria,100.0,Scheria,Scheria,100.0,Scheria,Scheria,100.0,Scheria,Scheria,100.0,Scheria,Scheria,100.0,Scheria,Scheria,100.0,Scheria,Scheria,0.0
644,who dies in the lost city of z,['Manley'],The Lost City of Z (film),-1.0,None,None,-1.0,None,None,0.0,Percy Fawcett,The Lost City of Z (film),0.0,Nina,The Lost City of Z (film),0.0,Percy Fawcett,The Lost City of Z (film),0.0,Fawcett,The Lost City of Z (film),1.0
645,when did the romanticism period start and end,"['in the approximate period from 1800 to 1850', 'originated in Europe toward the end of the 18th century , and in most areas was at its peak in the approximate period from 1800 to 1850', '1780 -- 1830']",Romanticism,33.33333333333333,1815 to 1848,Romanticism,80.0,middle of the 18th century,Romanticism,66.66666666666666,1800 until 1850,Romanticism,66.66666666666666,1800 until 1850,Romanticism,66.66666666666666,1800 until 1850,Romanticism,100.0,1800 to 1850,Romanticism,66.66666666666667
646,who was the first to say i'm going to disney world,"['Phil Simms', 'Dick Rutan']",I'm going to Disney World!,-1.0,None,None,0.0,ana Yeager,I'm going to Disney World!,0.0,ana Yeager,I'm going to Disney World!,0.0,Peyton Manning,I'm going to Disney World!,0.0,Patrick Mahomes,I'm going to Disney World!,0.0,Peyton Manning,I'm going to Disney World!,1.0
647,who wants a heart in the wizard of oz,"['the Tin Woodman', 'Tin Woodman']",Tin Woodman,100.0,Tin Woodman,Tin Woodman,100.0,Tin Woodman,Tin Woodman,100.0,Tin Woodman,Tin Woodman,100.0,Tin Woodman,Tin Woodman,100.0,Tin Woodman,Tin Woodman,100.0,Tin Woodman,Tin Woodman,0.0
648,when did the term sustainability start to be used,['1987'],History of sustainability,-1.0,None,None,0.0,307 BC,History of sustainability,0.0,307 BC,History of sustainability,0.0,307 BC,History of sustainability,0.0,1930s,History of sustainability,0.0,307 BC,History of sustainability,1.0
649,who stole the mona lisa from the louvre in 1911,['Vincenzo Peruggia'],Vincenzo Peruggia,100.0,Vincenzo Peruggia,Vincenzo Peruggia,100.0,Vincenzo Peruggia,Vincenzo Peruggia,100.0,Vincenzo Peruggia,Vincenzo Peruggia,100.0,Vincenzo Peruggia,Vincenzo Peruggia,100.0,Vincenzo Peruggia,Vincenzo Peruggia,100.0,Vincenzo Peruggia,Vincenzo Peruggia,0.0
650,where are unipolar neurons found in spinal cord,['the distal dorsal root'],Pseudounipolar neuron,47.76875403825262,dorsal root ganglion,Pseudounipolar neuron,47.76875403825262,dorsal root ganglion,Pseudounipolar neuron,47.76875403825262,dorsal root ganglion,Pseudounipolar neuron,16.666666666666668,sensory nuclei in the posterior horn,Pseudounipolar neuron,-1.0,None,None,47.76875403825262,dorsal root ganglia,Pseudounipolar neuron,48.76875403825262
651,when did the us stop drafting for the vietnam war,['1973'],Draft lottery (1969),100.0,1973,Draft lottery (1969),100.0,1973,Draft lottery (1969),33.33333333333333,"June 30, 1973",Draft lottery (1969),33.33333333333333,"June 30, 1973",Draft lottery (1969),10.000000000000002,"December 7, and authority to induct expired July 1, 1973",Draft lottery (1969),0.0,"November 26, 1969",Draft lottery (1969),100.0
652,who did us fight in world war 1,['Germany'],United States in World War I,-1.0,None,None,100.0,Germany,United States in World War I,100.0,Germany,United States in World War I,14.285714285714285,The United States declared war on Germany,United States in World War I,14.285714285714285,The United States declared war on Germany,United States in World War I,14.285714285714285,The United States declared war on Germany,United States in World War I,101.0
653,what is the largest bill in american money,['$100'],Large denominations of United States currency,0.0,gold certificates,Large denominations of United States currency,0.0,$500 bill,Large denominations of United States currency,0.0,$500,Large denominations of United States currency,100.0,$100,Large denominations of United States currency,100.0,$100,Large denominations of United States currency,100.0,$100,Large denominations of United States currency,100.0
654,when did the philadelphia eagles play in the super bowl last,['Super Bowl LII'],Super Bowl XXXIX,66.66666666666666,Super Bowl XXXVI,Super Bowl XXXIX,0.0,1981,Super Bowl XXXIX,0.0,1981,Super Bowl XXXIX,100.0,Super Bowl LII,Super Bowl XXXIX,0.0,1981,Super Bowl XXXIX,0.0,2017,Super Bowl XXXIX,100.0
655,what is the first step in the evolution of the eye,"['photoreceptor proteins that sense light', ""photoreceptor proteins that sense light , found even in unicellular organisms , called `` eyespots ''"", 'eyespots']",Evolution of the eye,100.0,photoreceptor proteins that sense light,Evolution of the eye,100.0,photoreceptor proteins that sense light,Evolution of the eye,100.0,photoreceptor proteins that sense light,Evolution of the eye,22.22222222222222,radical improvements in image-processing and detection of light direction,Evolution of the eye,100.0,photoreceptor proteins that sense light,Evolution of the eye,100.0,photoreceptor proteins that sense light,Evolution of the eye,77.77777777777777
656,who does the voice of mickey mouse on mickey mouse clubhouse,"['Wayne Allwine', 'Wayne Allwine as Mickey Mouse and Martian Mickey ( 2006 - 09 )']",Mickey Mouse Clubhouse,0.0,They Might Be Giants,Mickey Mouse Clubhouse,0.0,Bobs Gannaway,Mickey Mouse Clubhouse,0.0,Gannaway,Mickey Mouse Clubhouse,0.0,Bill Farmer,Mickey Mouse Clubhouse,100.0,Wayne Allwine,Mickey Mouse Clubhouse,100.0,Wayne Allwine,Mickey Mouse Clubhouse,100.0
657,where was the first session of the assam association held in1905,['Guwahati'],Tarun Ram Phukan,-1.0,None,None,100.0,Guwahati,Tarun Ram Phukan,100.0,Guwahati,Tarun Ram Phukan,100.0,Guwahati,Tarun Ram Phukan,-1.0,None,None,100.0,Guwahati,Tarun Ram Phukan,101.0
658,when did movies start coming out in color,"['1895', 'introduced around 1940']",Color motion picture film,100.0,1895,Color motion picture film,0.0,1902,Color motion picture film,0.0,1902,Color motion picture film,0.0,1902,Color motion picture film,0.0,1902,Color motion picture film,0.0,1902,Color motion picture film,100.0
659,when did they stop making pull tabs on beer cans,"['1970s', '1990']",Beverage can,0.0,late 1950s,Beverage can,100.0,1990,Beverage can,100.0,1990,Beverage can,0.0,early cans,Beverage can,-1.0,None,None,-1.0,None,None,101.0
660,who plays alec ramsay in the black stallion,['Kelly Reno'],Kelly Reno,100.0,Kelly Reno,Kelly Reno,100.0,Kelly Reno,Kelly Reno,100.0,Kelly Reno,Kelly Reno,100.0,Kelly Reno,Kelly Reno,100.0,Kelly Reno,Kelly Reno,100.0,Kelly Reno,Kelly Reno,0.0
661,who led the conquest of the incas in south america,"['conquistador Francisco Pizarro', 'Francisco Pizarro']",Spanish conquest of the Inca Empire,100.0,Francisco Pizarro,Spanish conquest of the Inca Empire,36.787944117144235,Pizarro,Spanish conquest of the Inca Empire,36.787944117144235,Pizarro,Spanish conquest of the Inca Empire,100.0,Francisco Pizarro,Spanish conquest of the Inca Empire,100.0,Francisco Pizarro,Spanish conquest of the Inca Empire,100.0,Francisco Pizarro,Spanish conquest of the Inca Empire,63.212055882855765
662,when did france and belgium invade the ruhr,"['January 1923', '11 January 1923', '1923']",Occupation of the Ruhr,100.0,January 11 1923,Occupation of the Ruhr,100.0,11 January 1923,Occupation of the Ruhr,100.0,11 January 1923,Occupation of the Ruhr,100.0,11 January 1923,Occupation of the Ruhr,100.0,11 January 1923,Occupation of the Ruhr,100.0,11 January 1923,Occupation of the Ruhr,0.0
663,what causes cracked skin at the corners of your mouth,['infection'],Angular cheilitis,0.0,Angular cheilitis,Angular cheilitis,33.33333333333333,herpes simplex infection,Angular cheilitis,0.0,dermatitis,Angular cheilitis,33.33333333333333,herpes simplex infection,Angular cheilitis,33.33333333333333,herpes simplex infection,Angular cheilitis,33.33333333333333,herpes simplex infection,Angular cheilitis,33.33333333333333
664,who is the guy who walked across the twin towers,['Philippe Petit'],Philippe Petit,100.0,Philippe Petit,Philippe Petit,100.0,Philippe Petit,Philippe Petit,100.0,Philippe Petit,Philippe Petit,100.0,Philippe Petit,Philippe Petit,100.0,Philippe Petit,Philippe Petit,100.0,Philippe Petit,Philippe Petit,0.0
665,what is the meaning of the harp in ireland,['the arms of Ireland'],Coat of arms of Ireland,50.0,High King of Ireland,Coat of arms of Ireland,57.14285714285714,the arms of the king of Ireland,Coat of arms of Ireland,57.14285714285714,the arms of the king of Ireland,Coat of arms of Ireland,57.14285714285714,the arms of the king of Ireland,Coat of arms of Ireland,-1.0,None,None,57.14285714285714,the arms of the king of Ireland,Coat of arms of Ireland,58.14285714285714
666,where did the book small steps take place,"['Austin , Texas']",Small Steps (novel),0.0,Camp Green Lake,Small Steps (novel),0.0,New York,Small Steps (novel),0.0,Delacorte Books,Small Steps (novel),0.0,Delacorte Books,Small Steps (novel),0.0,Delacorte Books,Small Steps (novel),0.0,Delacorte Books,Small Steps (novel),0.0
667,who was the winner of the first indianapolis 500,['Ray Harroun'],List of Indianapolis 500 winners,0.0,Drivers,List of Indianapolis 500 winners,100.0,Ray Harroun,List of Indianapolis 500 winners,100.0,Ray Harroun,List of Indianapolis 500 winners,100.0,Ray Harroun,List of Indianapolis 500 winners,100.0,Ray Harroun,List of Indianapolis 500 winners,100.0,Ray Harroun,List of Indianapolis 500 winners,100.0
668,the group that officially elects the president of the united states is called,"['the U.S. Electoral College', 'U.S. Electoral College']",United States presidential election,60.653065971263345,Electoral College,United States presidential election,60.653065971263345,Electoral College,United States presidential election,100.0,U.S. Electoral College,United States presidential election,100.0,U.S. Electoral College,United States presidential election,60.653065971263345,Electoral College,United States presidential election,60.653065971263345,Electoral College,United States presidential election,39.346934028736655
669,who do the characters represent in 8 mile,['loosely on Eminem'],8 Mile (film),5.000000000000001,Jimmy is not him but the story is semi-autobiographal. This allows Eminem to do more with the character of Jimmy,8 Mile (film),0.0,his myth,8 Mile (film),13.53352832366127,Eminem,8 Mile (film),0.0,his myth,8 Mile (film),0.0,"his alcoholic mother Stephanie, his younger sister Lily, and Stephanie's abusive live-in boyfriend Greg",8 Mile (film),0.0,his myth,8 Mile (film),13.53352832366127
670,the probability of making a type i error when retaining ho at the .05 level of significance is,['5 %'],Type I and type II errors,0.0,Greek letter alpha,Type I and type II errors,0.0,5%,Type I and type II errors,0.0,Bayesian point of view,Type I and type II errors,0.0,α,Type I and type II errors,0.0,5.96%,Type I and type II errors,0.0,5.96%,Type I and type II errors,0.0
671,when did we first put a rover on mars,['January 2004'],Exploration of Mars,0.0,1960s,Exploration of Mars,0.0,2003,Exploration of Mars,0.0,1962,Exploration of Mars,0.0,"August 6, 2012",Exploration of Mars,0.0,"August 6, 2012",Exploration of Mars,0.0,"August 6, 2012 UTC",Exploration of Mars,0.0
672,who developed the central processing unit (cpu),['John von Neumann'],Central processing unit,100.0,John von Neumann,Central processing unit,60.653065971263345,von Neumann,Central processing unit,60.653065971263345,von Neumann,Central processing unit,60.653065971263345,von Neumann,Central processing unit,60.653065971263345,von Neumann,Central processing unit,60.653065971263345,von Neumann,Central processing unit,39.346934028736655
673,what new deal program limited production in industry,"['NIRA', 'National Industrial Recovery Act']",New Deal,50.0,Frazier-Lemke Act,New Deal,100.0,NIRA,New Deal,50.0,Glass–Steagall Act,New Deal,50.0,Glass–Steagall Act,New Deal,100.0,National Industrial Recovery Act,New Deal,50.0,Glass–Steagall Act,New Deal,50.0
674,who sang i put a spell on you in hocus pocus,['Bette Midler'],I Put a Spell on You,100.0,Bette Midler,I Put a Spell on You,0.0,Arthur Brown,I Put a Spell on You,0.0,Jay Hawkins,I Put a Spell on You,0.0,Jay Hawkins,I Put a Spell on You,-1.0,None,None,0.0,"Jalacy ""Screamin' Jay"" Hawkins",I Put a Spell on You,101.0
675,what is the name of the compound p4010,['Phosphorus pentoxide'],Phosphorus pentoxide,100.0,Phosphorus pentoxide,Phosphorus pentoxide,0.0,P4O6 and P4O10,Phosphorus pentoxide,0.0,P4O6 and P4O10,Phosphorus pentoxide,0.0,P4O6 and P4O10,Phosphorus pentoxide,0.0,P4O6,Phosphorus pentoxide,0.0,"Onodera reagent"", a solution of P4O10 in DMSO, is employed for the oxidation of alcohols. This reaction is reminiscent of the Swern oxidation.
The desiccating power of P4O10 is strong enough to convert many mineral acids to their anhydrides. Examples: HNO3 is converted to N2O5;  H2SO4 is converted to SO3;  HClO4 is converted to Cl2O7;  CF3SO3H is converted to (CF3)2S2O5.
Agriculture.
The compound can be used as crop fertilizer",Phosphorus pentoxide,100.0
676,when was the first episode of scooby doo,"['September 13 , 1969']","List of Scooby-Doo, Where Are You! episodes",0.0,1978,"List of Scooby-Doo, Where Are You! episodes",0.0,1978,"List of Scooby-Doo, Where Are You! episodes",0.0,1978,"List of Scooby-Doo, Where Are You! episodes",0.0,1978,"List of Scooby-Doo, Where Are You! episodes",0.0,1978,"List of Scooby-Doo, Where Are You! episodes",0.0,1978,"List of Scooby-Doo, Where Are You! episodes",0.0
677,cast of the have and have nots play,['Palmer Williams Jr. as Floyd'],The Haves and the Have Nots (play),-1.0,None,None,33.33333333333333,"Floyd, played by Palmer Williams Jr.,",The Haves and the Have Nots (play),33.33333333333333,"Floyd, played by Palmer Williams Jr.,",The Haves and the Have Nots (play),33.33333333333333,"Floyd, played by Palmer Williams Jr.,",The Haves and the Have Nots (play),0.0,"The Haves and the Have Nots is a 2011 play by the American playwright Tyler Perry, later loosely adapted for television",The Haves and the Have Nots (play),0.0,"The Haves and the Have Nots is a 2011 play by the American playwright Tyler Perry, later loosely adapted for television",The Haves and the Have Nots (play),34.33333333333333
