,Question,GT Answer,GT Topic,2008 Bleu Score,2008 Predicted,2008 Topic,2014 Bleu Score,2014 Predicted,2014 Topic,2016 Bleu Score,2016 Predicted,2016 Topic,2018 Bleu Score,2018 Predicted,2018 Topic,2020 Bleu Score,2020 Predicted,2020 Topic,2021 Bleu Score,2021 Predicted,2021 Topic,max - min
301,who did the minnesota vikings lose to in the super bowl,['Kansas City Chiefs'],List of Super Bowl champions,37.5,The Kansas City Chiefs and New York Jets,List of Super Bowl champions,0.0,four,List of Super Bowl champions,0.0,0–4),List of Super Bowl champions,0.0,Bills,List of Super Bowl champions,0.0,Bills,List of Super Bowl champions,0.0,Bills,List of Super Bowl champions,37.5
302,when was the last grand slam hit in the world series,['2016'],Grand slam (baseball),0.0,"August 16, 1890",Grand slam (baseball),0.0,"August 16, 1890",Grand slam (baseball),0.0,"May 20, 1999",Grand slam (baseball),0.0,"July 25, 1956",Grand slam (baseball),0.0,June 23–25).,Grand slam (baseball),0.0,"April 1, 2007",Grand slam (baseball),0.0
303,who wrote catch 22 (both names),"['Joseph Heller', 'Joseph Heller .', 'American author Joseph Heller']",Catch-22,100.0,Joseph Heller,Catch-22,100.0,Joseph Heller,Catch-22,100.0,Joseph Heller,Catch-22,100.0,Joseph Heller,Catch-22,100.0,Joseph Heller,Catch-22,100.0,Joseph Heller,Catch-22,0.0
304,when was the last episode of vampire diaries aired,"['March 10 , 2017']",List of The Vampire Diaries episodes,-1.0,None,None,-1.0,None,None,-1.0,None,None,47.76875403825262,"March 10, 2017",List of The Vampire Diaries episodes,47.76875403825262,"March 10, 2017",List of The Vampire Diaries episodes,47.76875403825262,"March 10, 2017",List of The Vampire Diaries episodes,48.76875403825262
305,what is the strongest earthquake in the united states,['1964 Alaska earthquake and tsunami'],List of earthquakes in the United States,-1.0,None,None,-1.0,None,None,0.0,Earthquakes which affected the United States but whose epicenters were outside the United States borders,List of earthquakes in the United States,0.0,Earthquakes which affected the United States but whose epicenters were outside the United States borders,List of earthquakes in the United States,-1.0,None,None,0.0,tsunamis,List of earthquakes in the United States,1.0
306,when do liam and annie get together season 3,['Holiday Madness'],90210 (season 3),-1.0,None,None,0.0,after the season has completed broadcast on television,90210 (season 3),0.0,after the season has completed broadcast on television,90210 (season 3),-1.0,None,None,-1.0,None,None,0.0,after the season has completed broadcast on television,90210 (season 3),1.0
307,when did the angel of the north get built,"['1998', '1994']",Angel of the North,100.0,1994,Angel of the North,33.33333333333333,16 February 1998,Angel of the North,100.0,1998,Angel of the North,100.0,1998,Angel of the North,100.0,1998,Angel of the North,100.0,1998,Angel of the North,66.66666666666667
308,when was the latest version of chrome released,"['2018 - 01 - 23 ( Android ) 2018 - 01 - 24 ( iOS ) 2018 - 01 - 24 (', '2018 - 01 - 22']",Google Chrome version history,-1.0,None,None,-1.0,None,None,-1.0,None,None,0.0,release history,Google Chrome version history,0.0,every two to three weeks,Google Chrome version history,0.0,every two to three weeks,Google Chrome version history,1.0
309,what is the rate limiting enzyme of kreb's cycle,['Isocitrate dehydrogenase'],Citric acid cycle,50.0,pyruvate dehydrogenase,Citric acid cycle,50.0,succinate dehydrogenase,Citric acid cycle,50.0,succinate dehydrogenase,Citric acid cycle,50.0,succinate dehydrogenase,Citric acid cycle,50.0,succinate dehydrogenase,Citric acid cycle,0.0,NADH,Citric acid cycle,50.0
310,when was the taj mahal built and completed,['1632 -- 53'],Taj Mahal,0.0,1643,Taj Mahal,0.0,1643,Taj Mahal,0.0,1196,Taj Mahal,13.53352832366127,1632,Taj Mahal,0.0,1643,Taj Mahal,0.0,1653 A.D,Taj Mahal,13.53352832366127
311,who won the gold for the men's figure skating,['Yuzuru Hanyu'],List of Olympic medalists in figure skating,0.0,2006.,List of Olympic medalists in figure skating,0.0,Russian figure skaters,List of Olympic medalists in figure skating,0.0,Nikolai Panin,List of Olympic medalists in figure skating,0.0,Nikolai Panin,List of Olympic medalists in figure skating,0.0,Evgeni Plushenko,List of Olympic medalists in figure skating,0.0,Gillis Grafström,List of Olympic medalists in figure skating,0.0
312,when did the song holiday road come out,"['1983', 'June 24 , 1983']",Holiday Road,-1.0,None,None,100.0,1983,Holiday Road,100.0,1983,Holiday Road,100.0,1983,Holiday Road,100.0,1983,Holiday Road,100.0,1983,Holiday Road,101.0
313,when does the mlb season start and finish,"['March 29 -- October 31 , 2018', 'began on March 29 , 2018', 'March 29']",2018 Major League Baseball season,-1.0,None,None,-1.0,None,None,-1.0,None,None,100.0,March 29,2018 Major League Baseball season,100.0,March 29,2018 Major League Baseball season,100.0,March 29,2018 Major League Baseball season,101.0
314,who appoints the chief election commissioner of india,"['President of India', 'the president']",Chief Election Commissioner of India,75.0,The President of India,Chief Election Commissioner of India,100.0,the President,Chief Election Commissioner of India,100.0,the President,Chief Election Commissioner of India,100.0,the president,Chief Election Commissioner of India,100.0,the president,Chief Election Commissioner of India,100.0,the president,Chief Election Commissioner of India,25.0
315,who is the first prime minister of france,['Michel Debré'],Prime Minister of France,0.0,François Fillon,Prime Minister of France,0.0,Édith Cresson,Prime Minister of France,0.0,Édith Cresson,Prime Minister of France,0.0,Bernard Cazeneuve,Prime Minister of France,0.0,Jacques Chirac,Prime Minister of France,0.0,Jacques Chirac,Prime Minister of France,0.0
316,who eliminated costa rica in world cup 2014,['Netherlands'],Costa Rica at the FIFA World Cup,-1.0,None,None,-1.0,None,None,0.0,Costa Rica,Costa Rica at the FIFA World Cup,0.0,Costa Rica,Costa Rica at the FIFA World Cup,-1.0,None,None,0.0,Costa Rica,Costa Rica at the FIFA World Cup,1.0
317,who was the 11th prime minister of canada,"['R.B. Bennett', 'Arthur Meighen']",List of Prime Ministers of Canada,0.0,Louis-Hippolyte Lafontaine,List of Prime Ministers of Canada,0.0,John Turner,List of Prime Ministers of Canada,0.0,John Turner,List of Prime Ministers of Canada,0.0,John Turner,List of Prime Ministers of Canada,-1.0,None,None,-1.0,None,None,1.0
318,who has won the most world series in baseball,"['the New York Yankees', 'New York Yankees']",World Series,75.0,The New York Yankees,World Series,50.0,New York Yankees and the St. Louis Cardinals,World Series,0.0,Kansas City Royals,World Series,50.0,New York Yankees and the St. Louis Cardinals,World Series,100.0,New York Yankees,World Series,100.0,New York Yankees,World Series,100.0
319,who holds the record for most platinum albums,"['Elvis Presley', 'The Beatles', 'AC / DC']",Recording Industry Association of America certification,-1.0,None,None,-1.0,None,None,-1.0,None,None,0.0,Eminem,Recording Industry Association of America certification,-1.0,None,None,-1.0,None,None,1.0
320,when does season 2 of just add magic come out,"['January 19 , 2018', 'October 14 , 2016']",Just Add Magic (TV series),-1.0,None,None,-1.0,None,None,0.0,2015,Just Add Magic (TV series),47.76875403825262,"January 19, 2018",Just Add Magic (TV series),18.393972058572118,June 2016,Just Add Magic (TV series),47.76875403825262,"January 19, 2018",Just Add Magic (TV series),48.76875403825262
321,when does scully come back in season 2,"['One Breath', '8']",The X-Files (season 2),-1.0,None,None,0.0,"September 16, 1994",The X-Files (season 2),0.0,two episodes later,The X-Files (season 2),0.0,two episodes later,The X-Files (season 2),-1.0,None,None,0.0,two episodes later,The X-Files (season 2),1.0
322,how many episodes in series 7 of game of thrones are there,"['7', 'seven']",Game of Thrones (season 7),-1.0,None,None,-1.0,None,None,-1.0,None,None,100.0,seven,Game of Thrones (season 7),50.0,seven episodes,Game of Thrones (season 7),50.0,seven episodes,Game of Thrones (season 7),101.0
323,who has the best batting average in test cricket,"['Don Bradman', ""Australia 's Sir Donald Bradman"", 'Sir Donald Bradman']",Batting average,100.0,Sir Donald Bradman,Batting average,100.0,Sir Donald Bradman,Batting average,100.0,Sir Donald Bradman,Batting average,100.0,Sir Donald Bradman,Batting average,-1.0,None,None,100.0,Sir Donald Bradman,Batting average,101.0
324,winner of the women's royal rumble match,['Asuka'],Royal Rumble (2018),-1.0,None,None,-1.0,None,None,-1.0,None,None,100.0,Asuka,Royal Rumble (2018),100.0,Asuka,Royal Rumble (2018),100.0,Asuka,Royal Rumble (2018),101.0
325,when was the last time new england had a hurricane,"['Hurricane Hanna', 'September 19 - 22 , 2017', 'October 29 - 30 , 2012']",List of New England hurricanes,33.33333333333333,September of 1996,List of New England hurricanes,0.0,1991,List of New England hurricanes,0.0,1991,List of New England hurricanes,0.0,1991,List of New England hurricanes,0.0,1991,List of New England hurricanes,0.0,1991,List of New England hurricanes,33.33333333333333
326,when are the opening ceremonies for the 2018 olympic games,['9 February 2018'],2018 Winter Olympics opening ceremony,-1.0,None,None,-1.0,None,None,-1.0,None,None,100.0,9 February 2018,2018 Winter Olympics opening ceremony,100.0,9 February 2018,2018 Winter Olympics opening ceremony,100.0,9 February 2018,2018 Winter Olympics opening ceremony,101.0
327,who has the most restaurants in the world,['SUBWAY'],List of the largest fast food restaurant chains,-1.0,None,None,-1.0,None,None,-1.0,None,None,-1.0,None,None,0.0,3,List of the largest fast food restaurant chains,0.0,fast food restaurant chains by their number of locations in the world,List of the largest fast food restaurant chains,1.0
328,when is the new season of chicago pd,"['September 27 , 2017 ( 2017 - 09 - 27 ) -- present', 'September 27 , 2017']",Chicago P.D. (season 5),-1.0,None,None,-1.0,None,None,-1.0,None,None,47.76875403825262,"September 27, 2017",Chicago P.D. (season 5),47.76875403825262,"September 27, 2017",Chicago P.D. (season 5),47.76875403825262,"September 27, 2017",Chicago P.D. (season 5),48.76875403825262
329,when was the last time lebron scored 50 points,"['November 3 , 2017', 'March 5 , 2008']",List of 40-plus point games by LeBron James,-1.0,None,None,0.0,2014,List of 40-plus point games by LeBron James,0.0,2003,List of 40-plus point games by LeBron James,0.0,2003,List of 40-plus point games by LeBron James,-1.0,None,None,-1.0,None,None,1.0
330,when does congress declare war for the first time,"['June 18 , 1812', 'War of 1812']",Declaration of war by the United States,0.0,upon prior request by the President,Declaration of war by the United States,0.8196721311475409,"October Resolution itself spells out justifications for a war and frames itself as an 'authorization' of such a war."" in effect saying an authorization suffices for declaration and what some may view as a formal Congressional ""Declaration of War"" was not required by the Constitution.
This article will use the term ""formal declaration of war"" to mean Congressional legislation that uses the phrase ""declaration of war"" in the title. Elsewhere, this article will use the terms ""authorized by Congress"", ""funded by Congress"" or ""undeclared war"" to describe other such conflicts.
History.
The United States has formally declared war against foreign nations five separate times, each upon prior request by the President of the United States. Four of those five declarations came after hostilities had begun",Declaration of war by the United States,0.8196721311475409,"October Resolution itself spells out justifications for a war and frames itself as an 'authorization' of such a war."" in effect saying an authorization suffices for declaration and what some may view as a formal Congressional ""Declaration of War"" was not required by the Constitution.
This article will use the term ""formal declaration of war"" to mean Congressional legislation that uses the phrase ""declaration of war"" in the title. Elsewhere, this article will use the terms ""authorized by Congress"", ""funded by Congress"" or ""undeclared war"" to describe other such conflicts.
History.
The United States has formally declared war against foreign nations five separate times, each upon prior request by the President of the United States. Four of those five declarations came after hostilities had begun",Declaration of war by the United States,0.8196721311475409,"October Resolution itself spells out justifications for a war and frames itself as an 'authorization' of such a war."" in effect saying an authorization suffices for declaration and what some may view as a formal Congressional ""Declaration of War"" was not required by the Constitution.
This article will use the term ""formal declaration of war"" to mean Congressional legislation that uses the phrase ""declaration of war"" in the title. Elsewhere, this article will use the terms ""authorized by Congress"", ""funded by Congress"" or ""undeclared war"" to describe other such conflicts.
History.
The United States has formally declared war against foreign nations five separate times, each upon prior request by the President of the United States. Four of those five declarations came after hostilities had begun",Declaration of war by the United States,0.0,"March 21, 2011",Declaration of war by the United States,0.0,January 1971,Declaration of war by the United States,0.8196721311475409
331,what is the rank of india in economic growth,"['12 / 225', '12']",International rankings of India,-1.0,None,None,-1.0,None,None,0.0,85,International rankings of India,0.0,international rankings,International rankings of India,0.0,India's international rankings,International rankings of India,0.0,international rankings,International rankings of India,1.0
332,new anime from the creators of attack on titan,['Vinland Saga'],Wit Studio,-1.0,None,None,-1.0,None,None,0.0,Wit Studio,Wit Studio,0.0,Wit Studio,Wit Studio,0.0,"""Hal",Wit Studio,0.0,"Hal""",Wit Studio,1.0
333,how many episodes in season 2 of fargo,"['ten', '10']",Fargo (season 2),-1.0,None,None,-1.0,None,None,100.0,ten,Fargo (season 2),100.0,ten,Fargo (season 2),100.0,ten,Fargo (season 2),100.0,ten,Fargo (season 2),101.0
334,who wrote and performed i can only imagine,"['Christian rock band MercyMe', 'Bart Millard']",I Can Only Imagine (MercyMe song),-1.0,None,None,100.0,Bart Millard,I Can Only Imagine (MercyMe song),100.0,Bart Millard,I Can Only Imagine (MercyMe song),100.0,Bart Millard,I Can Only Imagine (MercyMe song),100.0,Bart Millard,I Can Only Imagine (MercyMe song),100.0,Bart Millard,I Can Only Imagine (MercyMe song),101.0
335,when did the last state became a state,"['August 21 , 1959', 'Hawaii']",List of U.S. states by date of admission to the Union,-1.0,None,None,0.0,between 1866 and 1870,List of U.S. states by date of admission to the Union,0.0,July 1776,List of U.S. states by date of admission to the Union,0.0,1787,List of U.S. states by date of admission to the Union,0.0,July 1776,List of U.S. states by date of admission to the Union,0.0,July 1776,List of U.S. states by date of admission to the Union,1.0
336,who has the most wins on around the horn,['Woody Paige'],Around the Horn,0.0,Jay Mariotti,Around the Horn,100.0,Woody Paige,Around the Horn,100.0,Woody Paige,Around the Horn,100.0,Woody Paige,Around the Horn,100.0,Woody Paige,Around the Horn,100.0,Woody Paige,Around the Horn,100.0
337,the first element on the periodic table is,"['Hydrogen', 'hydrogen']",Periodic table,100.0,hydrogen,Periodic table,0.0,neptunium,Periodic table,100.0,hydrogen,Periodic table,100.0,hydrogen,Periodic table,0.0,neptunium,Periodic table,100.0,Hydrogen,Periodic table,100.0
338,who won the 30 man royal rumble match,"['Shinsuke Nakamura', 'Randy Orton']",Royal Rumble,0.0,Stone Cold Steve Austin,Royal Rumble,0.0,Jim Duggan,Royal Rumble,36.787944117144235,Orton,Royal Rumble,0.0,Owen Hart,Royal Rumble,0.0,The winner of the event is the last wrestler remaining after all others have been eliminated,Royal Rumble,0.0,The winner of the event is the last wrestler remaining after all others have been eliminated,Royal Rumble,36.787944117144235
339,when does the new episodes of supernatural start,"['May 3 , 2018', 'October 12 , 2017']",Supernatural (season 13),-1.0,None,None,-1.0,None,None,-1.0,None,None,47.76875403825262,"October 12, 2017",Supernatural (season 13),-1.0,None,None,47.76875403825262,"October 12, 2017",Supernatural (season 13),48.76875403825262
340,what is the current rate of interest on ppf,"['7.6 % Per Annum', ""7.6 % Per Annum ' ( compounded annually )"", '7.6 %']",Public Provident Fund (India),-1.0,None,None,66.66666666666666,8.7% Per Annum,Public Provident Fund (India),66.66666666666666,8.1% Per Annum,Public Provident Fund (India),33.33333333333333,"7.6% Per Annum'""",Public Provident Fund (India),16.666666666666668,The interest rate compounded annually and paid on 31 March every year,Public Provident Fund (India),16.666666666666668,The interest rate compounded annually and paid on 31 March every year,Public Provident Fund (India),67.66666666666666
341,when is the fa cup semi-finals being played,['Wembley Stadium'],FA Cup semi-finals,-1.0,None,None,0.0,"They are the penultimate phase of the FA Cup, the oldest football tournament in the world.
Location.
The semi-finals are contested at neutral venues",FA Cup semi-finals,0.0,"They are the penultimate phase of the FA Cup, the oldest football tournament in the world.
Location.
The semi-finals are contested at neutral venues",FA Cup semi-finals,0.0,1999,FA Cup semi-finals,16.666666666666668,both semi-finals were held at Wembley,FA Cup semi-finals,16.666666666666668,both semi-finals were held at Wembley,FA Cup semi-finals,17.666666666666668
342,who wrote papa got a brand new bag,['James Brown'],Papa's Got a Brand New Bag,100.0,James Brown,Papa's Got a Brand New Bag,100.0,James Brown,Papa's Got a Brand New Bag,100.0,James Brown,Papa's Got a Brand New Bag,100.0,James Brown,Papa's Got a Brand New Bag,100.0,James Brown,Papa's Got a Brand New Bag,100.0,James Brown,Papa's Got a Brand New Bag,0.0
343,who has the most rings in the nba right now 2017,"['Bill Russell', 'Ginóbili , Manu Manu Ginóbili ^', 'Boston Celtics center Bill Russell']",List of NBA players with most championships,-1.0,None,None,100.0,Bill Russell,List of NBA players with most championships,100.0,Bill Russell,List of NBA players with most championships,100.0,Bill Russell,List of NBA players with most championships,100.0,Bill Russell,List of NBA players with most championships,100.0,Bill Russell,List of NBA players with most championships,101.0
344,when was the cleveland browns last winning game,['2016'],List of Cleveland Browns seasons,-1.0,None,None,0.0,1949,List of Cleveland Browns seasons,0.0,1949,List of Cleveland Browns seasons,0.0,1949,List of Cleveland Browns seasons,0.0,1949,List of Cleveland Browns seasons,0.0,1949,List of Cleveland Browns seasons,1.0
345,when was the last time the boston red sox pitched a no-hitter,"['May 19 , 2008']",List of Boston Red Sox no-hitters,-1.0,None,None,47.76875403825262,"May 19, 2008",List of Boston Red Sox no-hitters,-1.0,None,None,47.76875403825262,"May 19, 2008",List of Boston Red Sox no-hitters,47.76875403825262,"May 19, 2008",List of Boston Red Sox no-hitters,47.76875403825262,"May 19, 2008",List of Boston Red Sox no-hitters,48.76875403825262
346,when did somewhere over the rainbow come out,['1939'],Over the Rainbow,0.0,blue birds,Over the Rainbow,0.0,23 May 2010,Over the Rainbow,100.0,1939,Over the Rainbow,0.0,23 May 2010,Over the Rainbow,0.0,"May 23, 2010",Over the Rainbow,0.0,July 2021,Over the Rainbow,100.0
347,when did hootie and the blowfish come out,"['1986', '2003', 'March 4 , 2003']",Hootie & the Blowfish,-1.0,None,None,-1.0,None,None,-1.0,None,None,-1.0,None,None,-1.0,None,None,-1.0,None,None,0.0
348,who won nfl football coach of the year,['Sean McVay'],National Football League Coach of the Year Award,0.0,Paul Brown,National Football League Coach of the Year Award,0.0,Paul Brown,National Football League Coach of the Year Award,0.0,Paul Brown,National Football League Coach of the Year Award,-1.0,None,None,-1.0,None,None,0.0,Paul Brown,National Football League Coach of the Year Award,1.0
349,when did rob dyrdek's fantasy factory end,"['( 2015 - 03 - 05 )', 'March 5 , 2015']",Rob Dyrdek's Fantasy Factory,-1.0,None,None,0.0,"June 2014, MTV announced that ""Fantasy Factory"" would return for a seventh season",Rob Dyrdek's Fantasy Factory,47.76875403825262,"March 5, 2015",Rob Dyrdek's Fantasy Factory,-1.0,None,None,47.76875403825262,"March 5, 2015",Rob Dyrdek's Fantasy Factory,47.76875403825262,"March 5, 2015",Rob Dyrdek's Fantasy Factory,48.76875403825262
350,who won the first celebrity big brother on channel 5,['Jack Dee'],List of Celebrity Big Brother (UK) housemates,-1.0,None,None,-1.0,None,None,-1.0,None,None,0.0,Brian Dowling,List of Celebrity Big Brother (UK) housemates,-1.0,None,None,-1.0,None,None,1.0
351,who was the chief guest of 2014 republic day,['Prime Minister Shinzo Abe'],Republic Day (India),0.0,another head of state,Republic Day (India),0.0,President of India,Republic Day (India),0.0,President of India,Republic Day (India),0.0,President of India,Republic Day (India),0.0,President of India,Republic Day (India),0.0,President of India,Republic Day (India),0.0
352,legends of tomorrow season 3 finale air date,"['April 9 , 2018']",List of Legends of Tomorrow episodes,-1.0,None,None,-1.0,None,None,-1.0,None,None,0.0,"October 10, 2017",List of Legends of Tomorrow episodes,0.0,"January 7, 2020, the series was renewed for a sixth season, which is set to premiere in midseason 2021",List of Legends of Tomorrow episodes,0.0,"October 13, 2021",List of Legends of Tomorrow episodes,1.0
353,where is the orinoco river located on a map,"[""02 ° 19 ′ 05 '' N 63 ° 21 ′ 42 '' W \ufeff / \ufeff 2.31806 ° N 63.36167 ° W"", 'in South America']",Orinoco,0.0,Cerro Delgado-Chalbaud,Orinoco,16.666666666666668,Venezuela and the remainder in Colombia,Orinoco,16.666666666666668,Venezuela and the remainder in Colombia,Orinoco,16.666666666666668,Venezuela and the remainder in Colombia,Orinoco,0.0,Cerro Carlos Delgado Chalbaud,Orinoco,16.666666666666668,Venezuela and the remainder in Colombia,Orinoco,16.666666666666668
354,kings and queens of england in the 1900s,['Edward VII'],List of British monarchs,0.0,House of Hanover,List of British monarchs,0.0,Queen Anne,List of British monarchs,0.0,Queen Anne,List of British monarchs,0.0,plantations,List of British monarchs,0.0,Queen Anne,List of British monarchs,0.0,Queen Anne,List of British monarchs,0.0
355,who has the most followers in the world on instagram,"['Instagram', ""Instagram 's own account""]",List of most-followed Instagram accounts,-1.0,None,None,-1.0,None,None,-1.0,None,None,0.0,Selena Gomez,List of most-followed Instagram accounts,0.0,Cristiano Ronaldo,List of most-followed Instagram accounts,0.0,Cristiano Ronaldo,List of most-followed Instagram accounts,1.0
356,when does the 2017 college football season end,"['December 9 , 2017']",2017 NCAA Division I FBS football season,-1.0,None,None,-1.0,None,None,-1.0,None,None,47.76875403825262,"December 9, 2017",2017 NCAA Division I FBS football season,47.76875403825262,"December 9, 2017",2017 NCAA Division I FBS football season,47.76875403825262,"December 9, 2017",2017 NCAA Division I FBS football season,48.76875403825262
357,when was the last time astros was in the world series,"['2005', '2017']",Houston Astros,33.33333333333333,"October 9, 2005",Houston Astros,100.0,2005,Houston Astros,100.0,2005,Houston Astros,100.0,2005,Houston Astros,100.0,2005,Houston Astros,0.0,1980,Houston Astros,100.0
358,who is the drummer for guns and roses,['Frank Ferrer'],List of Guns N' Roses members,-1.0,None,None,-1.0,None,None,-1.0,None,None,0.0,Rob Gardner,List of Guns N' Roses members,1.6949152542372878,"Bryan ""Brain"" Mantia as his replacement. Finck later returned, and Guns N' Roses played its first live show in the US in seven years on December 31, 2000.
After eight years with the group, Paul Tobias left Guns N' Roses in July 2002, with Richard Fortus taking his place. Later in the year, the band embarked on the first leg of its extensive Chinese Democracy Tour, which was their first since 1993. After more touring, Buckethead abruptly left in March 2004, causing the band to cancel its appearance at Rock in Rio. The group continued work on new album ""Chinese Democracy"", but didn't perform again until May 2006 when Buckethead's replacement Ron ""Bumblefoot"" Thal debuted. In June, Frank Ferrer",List of Guns N' Roses members,2.6666666666666665,"Richard Fortus taking his place. Later in the year, the band embarked on the first leg of its extensive Chinese Democracy Tour, which was their first since 1993. After more touring, Buckethead abruptly left in March 2004, causing the band to cancel its appearance at Rock in Rio. The group continued work on new album ""Chinese Democracy"", but didn't perform again until May 2006 when Buckethead's replacement Ron ""Bumblefoot"" Thal debuted. In June, Frank Ferrer",List of Guns N' Roses members,3.6666666666666665
